"rank","title","price","rating","link","SKU","image_link"
"#70","Schesir Cat Multipack Tuna with Beef in Jelly 6x50g","SAR 46.92","4.5","https://www.amazon.sa//-/en/Schesir-Multipack-Tuna-Jelly-6x50g/dp/B004VJM3QA/ref=zg_bs_g_pet-supplies_d_sccl_20/262-6475623-0270327?psc=1","B004VJM3QA","https://images-eu.ssl-images-amazon.com/images/I/61yP7LSQ8PL._AC_UL600_SR600,400_.jpg"
"#71","Catsan 268058 Hygiene Cat Litter, 5L","SAR 32.95","4.0","https://www.amazon.sa//-/en/Catsan-268058-Hygiene-Cat-Litter/dp/B00GVDZA9G/ref=zg_bs_g_pet-supplies_d_sccl_21/262-6475623-0270327?psc=1","B00GVDZA9G","https://images-eu.ssl-images-amazon.com/images/I/71yoH7P5A5L._AC_UL600_SR600,400_.jpg"
"#72","PROTON Pet Stainless Steel Automatic Water Fountain, 2L/67OZ","SAR 97.99","4.5","https://www.amazon.sa//-/en/PROTON-Stainless-Steel-Automatic-Fountain/dp/B09Z6PXM5Z/ref=zg_bs_g_pet-supplies_d_sccl_22/262-6475623-0270327?psc=1","B09Z6PXM5Z","https://images-eu.ssl-images-amazon.com/images/I/714IslTKAyL._AC_UL600_SR600,400_.jpg"
"#73","Dotala Octagonal Pet Foldable Playpen Tent Dog and Cat Fence, Puppy Exercise Playpen,Cat and Dog House, Rabbit Cat Kennel (Rose)","SAR 46.99","4.6","https://www.amazon.sa//-/en/Dotala-Octagonal-Foldable-Playpen-Exercise/dp/B09L6Q1NPT/ref=zg_bs_g_pet-supplies_d_sccl_23/262-6475623-0270327?psc=1","B09L6Q1NPT","https://images-eu.ssl-images-amazon.com/images/I/61r7djNepKL._AC_UL600_SR600,400_.jpg"
"#74","AmazonBasics Cat Litter Box Mat - 24 x 35 Inches, Brown","SAR 19.00","4.5","https://www.amazon.sa//-/en/AmazonBasics-Cat-Litter-Box-Mat/dp/B071YQ6RJ8/ref=zg_bs_g_pet-supplies_d_sccl_24/262-6475623-0270327?psc=1","B071YQ6RJ8","https://images-eu.ssl-images-amazon.com/images/I/A1llMdUBl7L._AC_UL600_SR600,400_.jpg"
"#75","Intersand Odour Lock Calming Breeze Multi Cat Formula","SAR 88.32","4.4","https://www.amazon.sa//-/en/Intersand-Odour-Calming-Breeze-Formula/dp/B00LXYHLQI/ref=zg_bs_g_pet-supplies_d_sccl_25/262-6475623-0270327?psc=1","B00LXYHLQI","https://images-eu.ssl-images-amazon.com/images/I/61H5+a9aTsL._AC_UL600_SR600,400_.jpg"
"#76","Whiskas Tasty Mix, Chicken & Salmon with Seaweed, Wet Cat Food in Gravy, For Adult Cats Aged 1+ Years, Made from Real Fish that is Easy to Digest, for a Complete and Balanced Nutrition, Pack of 4x70g","SAR 14.80","4.4","https://www.amazon.sa//-/en/Whiskas-Tasty-Complete-Balanced-Nutrition/dp/B09L78HFWW/ref=zg_bs_g_pet-supplies_d_sccl_26/262-6475623-0270327?psc=1","B09L78HFWW","https://images-eu.ssl-images-amazon.com/images/I/71vCF2nYLDL._AC_UL600_SR600,400_.jpg"
"#77","Dr. Elsey's Premium Cat Litter - Ultra (18KG)","SAR 100.74","4.3","https://www.amazon.sa//-/en/Dr-Elseys-Premium-Cat-Litter/dp/B0009X29WK/ref=zg_bs_g_pet-supplies_d_sccl_27/262-6475623-0270327?psc=1","B0009X29WK","https://images-eu.ssl-images-amazon.com/images/I/71yvqBnUtKL._AC_UL600_SR600,400_.jpg"
"#78","Bird Cage Large Parrot Birdcage Breeding Big Pigeon Villa Parakeet Macaw with Wheels Stand Perch for Small Medium Large Birds","SAR 295.99","4.2","https://www.amazon.sa//-/en/Parrot-Birdcage-Breeding-Pigeon-Parakeet/dp/B097BF24V7/ref=zg_bs_g_pet-supplies_d_sccl_28/262-6475623-0270327?psc=1","B097BF24V7","https://images-eu.ssl-images-amazon.com/images/I/71wfxi7ne-L._AC_UL600_SR600,400_.jpg"
"#79","SLE Electric Mouse Cat Toys With Feather Toys, Rechargeable Interactive Cat Toys That Cats can Chase, Increase Their Exercise and Improve Their Attention Span,a Good Choice of Gift for Your Cat","SAR 39.99","4.1","https://www.amazon.sa//-/en/SLE-Electric-Rechargeable-Interactive-Attention/dp/B0BZGYX3C2/ref=zg_bs_g_pet-supplies_d_sccl_29/262-6475623-0270327?psc=1","B0BZGYX3C2","https://images-eu.ssl-images-amazon.com/images/I/715aJplEF2L._AC_UL600_SR600,400_.jpg"
"#80","Inaba Churro Assortment Of Chicken Flavor Treat for Cat 14 g, 40-Pack","SAR 130.07","4.7","https://www.amazon.sa//-/en/Churro-Assortment-Chicken-Flavor-40-Pack/dp/B0B52MBWNB/ref=zg_bs_g_pet-supplies_d_sccl_30/262-6475623-0270327?psc=1","B0B52MBWNB","https://images-eu.ssl-images-amazon.com/images/I/81sUxKljWaL._AC_UL600_SR600,400_.jpg"
"#81","21 Pcs laiyouqu Cat Kitten Toys Supplies, With Three-hole Tunnel/Interactive Mouse/Cat Stick Wand/Feather Golf Balls/Fluffy Balls لعبة القط & مستلزمات القطط","SAR 38.99","4.2","https://www.amazon.sa//-/en/laiyouqu-Supplies-Three-hole-Interactive-%D9%85%D8%B3%D8%AA%D9%84%D8%B2%D9%85%D8%A7%D8%AA/dp/B0BDMSQ71F/ref=zg_bs_g_pet-supplies_d_sccl_81/262-6475623-0270327?psc=1","B0BDMSQ71F","https://images-eu.ssl-images-amazon.com/images/I/811G3wLyFqS._AC_UL300_SR300,200_.jpg"
"#82","Schesir Cat Multipack Tuna Nt Style in Cooking Water 6x50g","SAR 46.00","4.5","https://www.amazon.sa//-/en/Schesir-Multipack-Style-Cooking-Water/dp/B004VJNE4U/ref=zg_bs_g_pet-supplies_d_sccl_82/262-6475623-0270327?psc=1","B004VJNE4U","https://images-eu.ssl-images-amazon.com/images/I/51utjtNcJGL._AC_UL300_SR300,200_.jpg"
"#83","Havenfly Cat Pointer Toy, Cat Laser Pointer, 7 Adjustable Patterns Laser, Cat Toy Pointer for Indoor, Cat Red Dot Lazer Light, USB Charging","SAR 25.97","4.4","https://www.amazon.sa//-/en/Havenfly-Pointer-Adjustable-Patterns-Charging/dp/B0B7W89862/ref=zg_bs_g_pet-supplies_d_sccl_83/262-6475623-0270327?psc=1","B0B7W89862","https://images-eu.ssl-images-amazon.com/images/I/71upaWKGryL._AC_UL300_SR300,200_.jpg"
"#84","Signature7 Charcoal 2mm Tofu Cat Litter 2.5kg(7L)","SAR 29.00","3.7","https://www.amazon.sa//-/en/Signature7-Charcoal-Tofu-Litter-2-5kg/dp/B0CCD1J3TB/ref=zg_bs_g_pet-supplies_d_sccl_84/262-6475623-0270327?psc=1","B0CCD1J3TB","https://images-eu.ssl-images-amazon.com/images/I/611s11LT-4L._AC_UL300_SR300,200_.jpg"
"#85","Airtag Cat Collar, Air tag Cat Collar with Bell and Safety Buckle in 3/8"" Width, Reflective Collar with Waterproof Airtag Holder Compatible with Apple Airtag for Cat Dog Kitten Puppy (Black)","SAR 27.99","4.2","https://www.amazon.sa//-/en/Airtag-Collar-Reflective-Waterproof-Compatible/dp/B09QQ2X3S6/ref=zg_bs_g_pet-supplies_d_sccl_85/262-6475623-0270327?psc=1","B09QQ2X3S6","https://images-eu.ssl-images-amazon.com/images/I/71bJQUSWfYL._AC_UL300_SR300,200_.jpg"
"#86","Paw Cleaner, No-Rinse Waterless Shampoo Dogs Cats Feet Cleaning Silicone Pet Grooming Brush, Rose Scent, 5.07 oz, Unique Design Pet Shampoo","SAR 38.89","4.4","https://www.amazon.sa//-/en/No-Rinse-Waterless-Cleaning-Silicone-Grooming/dp/B0CGT6DG1B/ref=zg_bs_g_pet-supplies_d_sccl_86/262-6475623-0270327?psc=1","B0CGT6DG1B","https://images-eu.ssl-images-amazon.com/images/I/61qvHdWQq3L._AC_UL300_SR300,200_.jpg"
"#87","MP Bergamo Cat Litter Scoop for Fine Sand, Small, Beige","SAR 5.28","4.2","https://www.amazon.sa//-/en/Bergamo-Litter-Scoop-Small-Beige/dp/B0BZRQ1621/ref=zg_bs_g_pet-supplies_d_sccl_87/262-6475623-0270327?psc=1","B0BZRQ1621","https://images-eu.ssl-images-amazon.com/images/I/51Mg83SR8CL._AC_UL300_SR300,200_.jpg"
"#88","Whiskas Chicken in Gravy Can, Wet Cat Food, for 1+ Years Adult Cats, High Quality Ingredients, Enriched with Proteins, Vitamins & Nutrients for a Complete & Balanced Nutrition, 400g","SAR 14.95","4.2","https://www.amazon.sa//-/en/Whiskas-Ingredients-Enriched-Nutrients-Nutrition/dp/B07MX94VR8/ref=zg_bs_g_pet-supplies_d_sccl_88/262-6475623-0270327?psc=1","B07MX94VR8","https://images-eu.ssl-images-amazon.com/images/I/7126sWixSEL._AC_UL300_SR300,200_.jpg"
"#89","Purina Friskies Turkey Chunks In Gravy Wet Cat Food Pouch, 26 X 85 G, Yellow","SAR 90.71","4.2","https://www.amazon.sa//-/en/Purina-Friskies-Turkey-Chunks-Yellow/dp/B0811T31S3/ref=zg_bs_g_pet-supplies_d_sccl_89/262-6475623-0270327?psc=1","B0811T31S3","https://images-eu.ssl-images-amazon.com/images/I/91XIij+zxZL._AC_UL300_SR300,200_.jpg"
"#90","Royalist Kitten Cat Food Chicken 2kg","SAR 49.61","4.9","https://www.amazon.sa//-/en/Royalist-Kitten-Cat-Food-Chicken/dp/B08XTW4XNR/ref=zg_bs_g_pet-supplies_d_sccl_90/262-6475623-0270327?psc=1","B08XTW4XNR","https://images-eu.ssl-images-amazon.com/images/I/71AfrkA7b-L._AC_UL300_SR300,200_.jpg"
"#91","Catmint Natural Silvervine Sticks, Catnip Cat Chew Sticks for Teeth Cleaning, Matatabi Kitten Dental Interactive Toy for Cats Lick (3pcs)","SAR 29.00","4.3","https://www.amazon.sa//-/en/Silvervine-Cleaning-Matatabi-Interactive-3pcs/dp/B0BZXS6399/ref=zg_bs_g_pet-supplies_d_sccl_91/262-6475623-0270327?psc=1","B0BZXS6399","https://images-eu.ssl-images-amazon.com/images/I/712PORHZEfL._AC_UL300_SR300,200_.jpg"
"#92","Cat Grass, New Potted Wheat Seed for Cat Grass Cultivation with Soilless Water Culture and Multi functional Aid in Digestion of Cat Snacks, Natural Hairball Control and Digestion Remedy for Cats.","SAR 35.91","3.9","https://www.amazon.sa//-/en/Cultivation-Soilless-functional-Digestion-Hairball/dp/B0CGLNK28T/ref=zg_bs_g_pet-supplies_d_sccl_92/262-6475623-0270327?psc=1","B0CGLNK28T","https://images-eu.ssl-images-amazon.com/images/I/61UsBxc4SRL._AC_UL300_SR300,200_.jpg"
"#93","Dr.Beckmann 2 in 1 Multipurpose Pet Stain remover shampoo with Cleaning brush|Advanced Oxi powered Formula|Easy to use|Home & Pet Care Essentials|DIY|Eliminates Tough Stains & Odours|650 ml","SAR 48.00","4.4","https://www.amazon.sa//-/en/Dr-Beckmann-Multipurpose-Cleaning-Essentials-Eliminates/dp/B08R3HT6V5/ref=zg_bs_g_pet-supplies_d_sccl_93/262-6475623-0270327?psc=1","B08R3HT6V5","https://images-eu.ssl-images-amazon.com/images/I/71nUZU2R+4L._AC_UL300_SR300,200_.jpg"
"#94","Double duty clumping cat litter 6.35 kg","SAR 58.27","4.3","https://www.amazon.sa//-/en/Double-duty-clumping-litter-6-35/dp/B0045VJRKO/ref=zg_bs_g_pet-supplies_d_sccl_94/262-6475623-0270327?psc=1","B0045VJRKO","https://images-eu.ssl-images-amazon.com/images/I/71G+OV3XSdL._AC_UL300_SR300,200_.jpg"
"#95","Cat Bowl Dog Water Feeder Bowl Cat Kitten Drinking Fountain Food Dish Pet Bowl Goods","SAR 22.40","4.2","https://www.amazon.sa//-/en/Water-Feeder-Kitten-Drinking-Fountain/dp/B0844FVDX4/ref=zg_bs_g_pet-supplies_d_sccl_95/262-6475623-0270327?psc=1","B0844FVDX4","https://images-eu.ssl-images-amazon.com/images/I/51F1Hh9qWvL._AC_UL300_SR300,200_.jpg"
"#96","Pedigree Beef & Vegetables, Dry Dog Food (Adult), 3Kg","SAR 51.00","4.2","https://www.amazon.sa//-/en/Pedigree-Beef-Vegetables-Food-Adult/dp/B071RYCF1C/ref=zg_bs_g_pet-supplies_d_sccl_96/262-6475623-0270327?psc=1","B071RYCF1C","https://images-eu.ssl-images-amazon.com/images/I/814A+Ii2x6L._AC_UL300_SR300,200_.jpg"
"#97","Whiskas Purrfectly Chicken Entrée Cat Food, Pouch, 24 X 85 G","SAR 85.10","4.3","https://www.amazon.sa//-/en/Whiskas-Purrfectly-Chicken-Entr%C3%A9e-Pouch/dp/B07PKDKJ1S/ref=zg_bs_g_pet-supplies_d_sccl_97/262-6475623-0270327?psc=1","B07PKDKJ1S","https://images-eu.ssl-images-amazon.com/images/I/81-sMFqXjCL._AC_UL300_SR300,200_.jpg"
"#98","TAME 14 PCS Cat Toys Kitten Toys Assortments,Cat Toy Roller 3-Level Turntable, Cat Feather Teaser,Interactive Kitten Fun Mental Physical Exercise Puzzle Toys","SAR 29.99","4.4","https://www.amazon.sa//-/en/TAME-Cat-Assortments-Toy-Interactive/dp/B08Z3NCKRV/ref=zg_bs_g_pet-supplies_d_sccl_98/262-6475623-0270327?psc=1","B08Z3NCKRV","https://images-eu.ssl-images-amazon.com/images/I/71aqH1Uon6L._AC_UL300_SR300,200_.jpg"
"#99","Royal Canin Gravy Kitten Instinctive 12X 85 Gm Pouches Wet Food","SAR 105.00","4.5","https://www.amazon.sa//-/en/Royal-Canin-Kitten-Instinctive-Pouches/dp/B002TDWWF2/ref=zg_bs_g_pet-supplies_d_sccl_99/262-6475623-0270327?psc=1","B002TDWWF2","https://images-eu.ssl-images-amazon.com/images/I/81c7pMs-sjL._AC_UL300_SR300,200_.jpg"
"#100","PK.ZTopia 12-Pack Cat Water Fountain Filter, Pet Fountain Filters, Filters for Pet Water Fountains,Round Replacement Cat Filters for 84oz/2.5L Water Fountain, Filters for Drinking Cat","SAR 29.99","4.3","https://www.amazon.sa//-/en/PK-ZTopia-Fountain-Fountains-Replacement-Drinking/dp/B082CVL6BX/ref=zg_bs_g_pet-supplies_d_sccl_100/262-6475623-0270327?psc=1","B082CVL6BX","https://images-eu.ssl-images-amazon.com/images/I/71HIFTbR3IL._AC_UL300_SR300,200_.jpg"