"rank","title","price","rating","link","SKU","image_link"
"#1","Whiskas Oceanfish Catfood, Purple, 80 g, Pack Of 12, 430440","SAR 29.30","4.3","https://www.amazon.sa//-/en/Whiskas-Oceanfish-Catfood-Purple-430440/dp/B09KQ58SJL/ref=zg_bs_g_pet-supplies_d_sccl_1/262-6475623-0270327?psc=1","B09KQ58SJL","https://images-eu.ssl-images-amazon.com/images/I/710xaEGR89L._AC_UL600_SR600,400_.jpg"
"#2","Thomas Cat Litter, Natural Minerals Litter Sand, it's Non-Clumping and Highly Absorbent Nature Ensures Your Cat to Come Back to its Cat Litter Box with Comfort, Bag of 16L","SAR 48.95","4.0","https://www.amazon.sa//-/en/Thomas-Natural-Minerals-Non-Clumping-Absorbent/dp/B0037XNXIS/ref=zg_bs_g_pet-supplies_d_sccl_2/262-6475623-0270327?psc=1","B0037XNXIS","https://images-eu.ssl-images-amazon.com/images/I/71GxceNAFeL._AC_UL600_SR600,400_.jpg"
"#3","Royalist Cat Creamy Snack Pack Salmon 75g (5×15g)","SAR 10.88","5.0","https://www.amazon.sa//-/en/Royalist-Creamy-Snack-Salmon-5%C3%9715g/dp/B0CRZ4NVV5/ref=zg_bs_g_pet-supplies_d_sccl_3/262-6475623-0270327?psc=1","B0CRZ4NVV5","https://images-eu.ssl-images-amazon.com/images/I/61vcqX2z8eL._AC_UL600_SR600,400_.jpg"
"#4","Whiskas Wet Cat Food Tuna, Made with Real Fish, for Adult Cats 1+ Years, Flavor Lock Pouch Made for Sealing Freshness, High Quality Ingredients for a Complete & Balanced Nutrition, Pack of 12x80g","SAR 29.20","4.4","https://www.amazon.sa//-/en/Whiskas-Freshness-Ingredients-Complete-Nutrition/dp/B09KMCCJY4/ref=zg_bs_g_pet-supplies_d_sccl_4/262-6475623-0270327?psc=1","B09KMCCJY4","https://images-eu.ssl-images-amazon.com/images/I/71lZXtjHObL._AC_UL600_SR600,400_.jpg"
"#5","Whiskas Chicken in Gravy, Wet Cat Food Pouch, for 1+ Years Adult Cats, Flavor Lock Pouch for Sealing Freshness, Made with High Quality Ingredients for a Complete & Balanced Nutrition, Pack of 12x80g","SAR 29.00","4.3","https://www.amazon.sa//-/en/Whiskas-Freshness-Ingredients-Complete-Nutrition/dp/B09R2FM6HN/ref=zg_bs_g_pet-supplies_d_sccl_5/262-6475623-0270327?psc=1","B09R2FM6HN","https://images-eu.ssl-images-amazon.com/images/I/71FeEE5dNEL._AC_UL600_SR600,400_.jpg"
"#6","Whiskas Temptations Tender Chicken, 75g","SAR 8.50","4.7","https://www.amazon.sa//-/en/Whiskas-Temptations-Tender-Chicken-75g/dp/B006LRL8IO/ref=zg_bs_g_pet-supplies_d_sccl_6/262-6475623-0270327?psc=1","B006LRL8IO","https://images-eu.ssl-images-amazon.com/images/I/614sh5egGAL._AC_UL600_SR600,400_.jpg"
"#7","Purina Friskies Surfin Favourites Dry Cat Food 1.1kg","SAR 21.00","4.4","https://www.amazon.sa//-/en/Purina-Friskies-Surfin-Favourites-1-1kg/dp/B01CCWTBP8/ref=zg_bs_g_pet-supplies_d_sccl_7/262-6475623-0270327?psc=1","B01CCWTBP8","https://images-eu.ssl-images-amazon.com/images/I/81+WXr8yDbL._AC_UL600_SR600,400_.jpg"
"#8","Purina Friskies Surfin Favourites Dry Cat Food 6.5Kg","SAR 95.58","4.5","https://www.amazon.sa//-/en/Purina-Friskies-Surfin-Favourites-6-5Kg/dp/B07SGSMMBM/ref=zg_bs_g_pet-supplies_d_sccl_8/262-6475623-0270327?psc=1","B07SGSMMBM","https://images-eu.ssl-images-amazon.com/images/I/81nfY--G7-L._AC_UL600_SR600,400_.jpg"
"#9","Purina Friskies Kitten Food Discovery Cat Food 1.1kg","SAR 19.85","4.5","https://www.amazon.sa//-/en/Purina-Friskies-Kitten-Discovery-1-1kg/dp/B07SB15X7L/ref=zg_bs_g_pet-supplies_d_sccl_9/262-6475623-0270327?psc=1","B07SB15X7L","https://images-eu.ssl-images-amazon.com/images/I/81jN8ST0RCL._AC_UL600_SR600,400_.jpg"
"#10","Purina Friskies Indoor Delights Dry Cat Food 1.1Kg","SAR 21.00","4.6","https://www.amazon.sa//Purina-Friskies-Indoor-Delights-1-1Kg/dp/B06XYKJXWF/ref=zg_bs_g_pet-supplies_d_sccl_10/262-6475623-0270327?psc=1","B06XYKJXWF","https://images-eu.ssl-images-amazon.com/images/I/81tQmrEqjdL._AC_UL600_SR600,400_.jpg"
"#11","Whiskas Chicken Dry Food, for Adult Cats 1+ Years, Natural Fibers Gently Move Hairballs Through Your Cat’s Digestive System. Prepared with High Quality Natural Ingredients, Bag of 1.2 kg","SAR 24.80","4.4","https://www.amazon.sa//-/en/Whiskas-Hairballs-Digestive-Prepared-Ingredients/dp/B07P8B2PXP/ref=zg_bs_g_pet-supplies_d_sccl_11/262-6475623-0270327?psc=1","B07P8B2PXP","https://images-eu.ssl-images-amazon.com/images/I/71tPiqoCHRL._AC_UL600_SR600,400_.jpg"
"#12","Felyn Go Cat Litter Baby Powder 10L","SAR 31.95","3.5","https://www.amazon.sa//-/en/Felyn-Go-Litter-Baby-Powder/dp/B0CNGRJ25L/ref=zg_bs_g_pet-supplies_d_sccl_12/262-6475623-0270327?psc=1","B0CNGRJ25L","https://images-eu.ssl-images-amazon.com/images/I/61MBQ7Pq0cL._AC_UL600_SR600,400_.jpg"
"#13","Cat litter deodorizer powder","SAR 25.52","4.5","https://www.amazon.sa//-/en/ARM-HAMMER-thomaswi-litter-deodorizer/dp/B000V5NVQ4/ref=zg_bs_g_pet-supplies_d_sccl_13/262-6475623-0270327?psc=1","B000V5NVQ4","https://images-eu.ssl-images-amazon.com/images/I/81h9Az88HpL._AC_UL600_SR600,400_.jpg"
"#14","Whiskas Temptations Tuna Cat Treats 75g","SAR 8.50","4.7","https://www.amazon.sa//-/en/Whiskas-Temptations-Tuna-Cat-Treats/dp/B00LM92Z6U/ref=zg_bs_g_pet-supplies_d_sccl_14/262-6475623-0270327?psc=1","B00LM92Z6U","https://images-eu.ssl-images-amazon.com/images/I/71GevpysjFL._AC_UL600_SR600,400_.jpg"
"#15","PURINA ONE Indoor Advantage Chicken 1.2kg","SAR 37.51","4.6","https://www.amazon.sa//-/en/PURINA-ONE-Indoor-Advantage-Chicken/dp/B0B611V2YR/ref=zg_bs_g_pet-supplies_d_sccl_15/262-6475623-0270327?psc=1","B0B611V2YR","https://images-eu.ssl-images-amazon.com/images/I/71JrvMaCMGL._AC_UL600_SR600,400_.jpg"
"#16","Sheba Wet Cat Food Canned Delicious Chicken Breast, Made with Natural Chicken Plus Essential Vitamins and Minerals, Sheba Wet Food Made with Grain Free Formula Suitable for Sensitive Cats, 6 x 85g","SAR 32.20","4.6","https://www.amazon.sa//-/en/Sheba-Delicious-Essential-Vitamins-Sensitive/dp/B07PLZX89B/ref=zg_bs_g_pet-supplies_d_sccl_16/262-6475623-0270327?psc=1","B07PLZX89B","https://images-eu.ssl-images-amazon.com/images/I/71dynqi7jKL._AC_UL600_SR600,400_.jpg"
"#17","Fancy Feast Puree Kiss Tuna Puree with Chicken Flakes, 10g x 4","SAR 9.56","4.6","https://www.amazon.sa//-/en/Fancy-Feast-Puree-Chicken-Flakes/dp/B07KX45BNN/ref=zg_bs_g_pet-supplies_d_sccl_17/262-6475623-0270327?psc=1","B07KX45BNN","https://images-eu.ssl-images-amazon.com/images/I/71c6aGPVFoL._AC_UL600_SR600,400_.jpg"
"#18","Temptations Savory Salmon Cat Treats 75g","SAR 8.50","4.6","https://www.amazon.sa//-/en/Temptations-Savory-Salmon-Cat-Treats/dp/B000VDR8BU/ref=zg_bs_g_pet-supplies_d_sccl_18/262-6475623-0270327?psc=1","B000VDR8BU","https://images-eu.ssl-images-amazon.com/images/I/81CNrg3YbPL._AC_UL600_SR600,400_.jpg"
"#19","Purina Friskies Meaty Grill Dry Cat Food 1.1kg","SAR 23.35","4.5","https://www.amazon.sa//-/en/Purina-Friskies-Meaty-Grill-1-1kg/dp/B01CCWX4AG/ref=zg_bs_g_pet-supplies_d_sccl_19/262-6475623-0270327?psc=1","B01CCWX4AG","https://images-eu.ssl-images-amazon.com/images/I/81TtfLNsRZL._AC_UL600_SR600,400_.jpg"
"#20","Sheba Cat Food Tuna & Salmon Can, Made from Natural Ingredients with Essential Vitamins and Minerals, this Sheba Wet Food is Made with a Grain Free Formula Suitable for Sensitive Cats, Pack of 6x85g","SAR 32.80","4.5","https://www.amazon.sa//-/en/Sheba-Ingredients-Essential-Vitamins-Sensitive/dp/B07PHC7MGS/ref=zg_bs_g_pet-supplies_d_sccl_20/262-6475623-0270327?psc=1","B07PHC7MGS","https://images-eu.ssl-images-amazon.com/images/I/71KmPIKQYYL._AC_UL600_SR600,400_.jpg"
"#21","Whiskas Purrfectly Chicken, Chicken Entree Wet Cat Food for Adult Cats 1+ Years, Flavor Lock Pouch for Sealing Freshness, Made with High Quality Ingredients, for a Complete Nutrition, Pack of 12x85g","SAR 35.50","4.2","https://www.amazon.sa//-/en/Whiskas-Purrfectly-Freshness-Ingredients-Nutrition/dp/B09KQ34Q4Y/ref=zg_bs_g_pet-supplies_d_sccl_21/262-6475623-0270327?psc=1","B09KQ34Q4Y","https://images-eu.ssl-images-amazon.com/images/I/7190RW2c4DL._AC_UL600_SR600,400_.jpg"
"#22","Purina Tidy Cats Non Clumping Cat Litter 24/7 Performance 20Lb","SAR 30.90","3.7","https://www.amazon.sa//-/en/Purina-Tidy-Cats-Clumping-Performance/dp/B000R4JIUW/ref=zg_bs_g_pet-supplies_d_sccl_22/262-6475623-0270327?psc=1","B000R4JIUW","https://images-eu.ssl-images-amazon.com/images/I/81AJXEovsYL._AC_UL600_SR600,400_.jpg"
"#23","AmazonBasics 19-Inch Two Door Top Load Pet Kennel","SAR 35.00","4.5","https://www.amazon.sa//-/en/AmazonBasics-19-Inch-Door-Load-Kennel/dp/B00OP6SMCI/ref=zg_bs_g_pet-supplies_d_sccl_23/262-6475623-0270327?psc=1","B00OP6SMCI","https://images-eu.ssl-images-amazon.com/images/I/71WgHnZShvL._AC_UL600_SR600,400_.jpg"
"#24","Thomas Cat Litter, Natural Minerals Litter Sand, it's Clumping and Highly Absorbent Nature Ensures Your Cat to Come Back to its Cat Litter Box with Comfort, Bag of 5kg","SAR 27.23","4.2","https://www.amazon.sa//-/en/Thomas-Natural-Minerals-Clumping-Absorbent/dp/B003ZDTYD8/ref=zg_bs_g_pet-supplies_d_sccl_24/262-6475623-0270327?psc=1","B003ZDTYD8","https://images-eu.ssl-images-amazon.com/images/I/71UgYfUFvPL._AC_UL600_SR600,400_.jpg"
"#25","Whiskas Gourmet Seafood Dry Food, for Adult Cats 1+ Years, Formulated to Help Maintain a Healthy, Digestive Tract. Sustain a Healthy Weight, Complete & Balanced Nutrition for Your Meow, Bag of 3kg.","SAR 53.20","4.4","https://www.amazon.sa//-/en/Whiskas-Formulated-Maintain-Digestive-Nutrition/dp/B07N6HR6QQ/ref=zg_bs_g_pet-supplies_d_sccl_25/262-6475623-0270327?psc=1","B07N6HR6QQ","https://images-eu.ssl-images-amazon.com/images/I/71t0Nums8sL._AC_UL600_SR600,400_.jpg"
"#26","Whiskas Kitten Tuna 80g pack of 24 Purple, 430430_1, Catfood","SAR 65.40","4.4","https://www.amazon.sa//-/en/Whiskas-Kitten-Purple-430430_1-Catfood/dp/B09KQ6219M/ref=zg_bs_g_pet-supplies_d_sccl_26/262-6475623-0270327?psc=1","B09KQ6219M","https://images-eu.ssl-images-amazon.com/images/I/71uwcgMF6iL._AC_UL600_SR600,400_.jpg"
"#27","Amazon Basics No-Mess Hooded Cat Litter Box, 24 x 18 x 17 Inches, Large","SAR 59.00","4.6","https://www.amazon.sa//-/en/Amazon-Basics-No-Mess-Hooded-Litter/dp/B0752V2ZD7/ref=zg_bs_g_pet-supplies_d_sccl_27/262-6475623-0270327?psc=1","B0752V2ZD7","https://images-eu.ssl-images-amazon.com/images/I/715Pu+XZOTL._AC_UL600_SR600,400_.jpg"
"#28","Purina Felix As Good As It Looks Kitten with Countryside Selection in jelly 85g (Pack of 12)","Price N/A","4.5","https://www.amazon.sa//-/en/Purina-Felix-Kitten-Countryside-Selection/dp/B08YNKH2N9/ref=zg_bs_g_pet-supplies_d_sccl_28/262-6475623-0270327?psc=1","B08YNKH2N9","https://images-eu.ssl-images-amazon.com/images/I/71NcGotNpGL._AC_UL600_SR600,400_.jpg"
"#29","Brit Premium by Nature Cat Sticks with Salmon & Trout, 3pcs","SAR 13.95","4.5","https://www.amazon.sa//-/en/Brit-Premium-Nature-Sticks-Salmon/dp/B099F27PRZ/ref=zg_bs_g_pet-supplies_d_sccl_29/262-6475623-0270327?psc=1","B099F27PRZ","https://images-eu.ssl-images-amazon.com/images/I/913ZpCrrD5L._AC_UL300_SR300,200_.jpg"
"#30","Felix Purina Doubly Delicious Fish Selection in Jelly Wet Cat Food Box, 85g (Pack of 12)","SAR 54.95","4.6","https://www.amazon.sa//-/en/Felix-Purina-Doubly-Delicious-Selection/dp/B08YNK99N1/ref=zg_bs_g_pet-supplies_d_sccl_30/262-6475623-0270327?psc=1","B08YNK99N1","https://images-eu.ssl-images-amazon.com/images/I/71ArHsKyRZL._AC_UL300_SR300,200_.jpg"
"#31","S7 Bentonite Cat Litter Green Apple 10L","SAR 41.06","4.3","https://www.amazon.sa//-/en/Bentonite-Cat-Litter-Green-Apple/dp/B0B94MP9J9/ref=zg_bs_g_pet-supplies_d_sccl_31/262-6475623-0270327?psc=1","B0B94MP9J9","https://images-eu.ssl-images-amazon.com/images/I/51UK8j7r-JL._AC_UL300_SR300,200_.jpg"
"#32","Temptations Whiskas Seafood Medley Cat Treats 75g","SAR 8.50","4.6","https://www.amazon.sa//-/en/Temptations-Whiskas-Seafood-Medley-Treats/dp/B004UMMTWQ/ref=zg_bs_g_pet-supplies_d_sccl_32/262-6475623-0270327?psc=1","B004UMMTWQ","https://images-eu.ssl-images-amazon.com/images/I/61CTs3i+N-L._AC_UL300_SR300,200_.jpg"
"#33","SKY-TOUCH Disposable Absorbent Quick Drying Leak-Proof Pee Pads For Potty Training For Pets, 60X60Cm L - 40 Pieces, Blue, L - 60X60Cm","SAR 25.42","4.7","https://www.amazon.sa//-/en/SKY-TOUCH-Disposable-Absorbent-Leak-Proof-Pee/dp/B0BFXSCKN7/ref=zg_bs_g_pet-supplies_d_sccl_33/262-6475623-0270327?psc=1","B0BFXSCKN7","https://images-eu.ssl-images-amazon.com/images/I/71jvhSgFYQL._AC_UL300_SR300,200_.jpg"
"#34","Kitekat Mackerel Flavor Dry Cat Food, 7 Kg","SAR 111.20","4.2","https://www.amazon.sa//Kitekat-Mackerel-Flavor-Dry-Food/dp/B076GMVVXM/ref=zg_bs_g_pet-supplies_d_sccl_34/262-6475623-0270327?psc=1","B076GMVVXM","https://images-eu.ssl-images-amazon.com/images/I/71-rgaTbbIL._AC_UL300_SR300,200_.jpg"
"#35","Potaroma 4 pack catnip wall balls cat toys, interactive edible cat nip treat toy for kitten to lick safely, rotatable chewing candy snack teeth cleaning cat licker","SAR 28.98","4.0","https://www.amazon.sa//-/en/Potaroma-interactive-rotatable-chewing-cleaning/dp/B08T9CL5T9/ref=zg_bs_g_pet-supplies_d_sccl_35/262-6475623-0270327?psc=1","B08T9CL5T9","https://images-eu.ssl-images-amazon.com/images/I/61-GOCvS5US._AC_UL300_SR300,200_.jpg"
"#36","Fancy Feast Puree Kiss Chicken with Tuna Flakes Cat Food, Pack of 4, 40 grams","SAR 11.25","4.6","https://www.amazon.sa//-/en/Fancy-Feast-Puree-Chicken-Flakes/dp/B07KX3BNKD/ref=zg_bs_g_pet-supplies_d_sccl_36/262-6475623-0270327?psc=1","B07KX3BNKD","https://images-eu.ssl-images-amazon.com/images/I/71kE7stvPQL._AC_UL300_SR300,200_.jpg"
"#37","Felix Purina Naturally Delicious Countryside Selection in Jelly Wet Cat Food, 85g (12 Pouches)","SAR 70.38","4.7","https://www.amazon.sa//-/en/Felix-Naturally-Delicious-Countryside-Selection/dp/B08YNJWQXB/ref=zg_bs_g_pet-supplies_d_sccl_37/262-6475623-0270327?psc=1","B08YNJWQXB","https://images-eu.ssl-images-amazon.com/images/I/81MilLv1OyL._AC_UL300_SR300,200_.jpg"
"#38","Sheba Cat Food Chicken with Shrimp & Tuna Filets, from Natural Chicken Breast, Sheba Wet Food made for Reliable Consumption, Enriched with the Necessary Nutritional Requirements, Pack of 16x60g","SAR 100.40","4.7","https://www.amazon.sa//-/en/Sheba-Consumption-Necessary-Nutritional-Requirements/dp/B09P1TH8LH/ref=zg_bs_g_pet-supplies_d_sccl_38/262-6475623-0270327?psc=1","B09P1TH8LH","https://images-eu.ssl-images-amazon.com/images/I/81yHfwVOiYL._AC_UL300_SR300,200_.jpg"
"#39","Duck Fillet Chewy Stick For Adult Dogs, 90g","SAR 20.01","4.7","https://www.amazon.sa//-/en/Duck-Fillet-Chewy-Stick-Adult/dp/B0848J1JY8/ref=zg_bs_g_pet-supplies_d_sccl_39/262-6475623-0270327?psc=1","B0848J1JY8","https://images-eu.ssl-images-amazon.com/images/I/811qjp6N8gL._AC_UL300_SR300,200_.jpg"
"#40","Sheba Cat Food Chicken with Sustainable Tuna Filets, from Natural Chicken Breast, Sheba Wet Food made for Reliable Consumption, Enriched with the Necessary Nutritional Requirements, Pack of 16x60g","SAR 100.40","4.7","https://www.amazon.sa//-/en/Sustainable-Consumption-Necessary-Nutritional-Requirements/dp/B09P1TXKDZ/ref=zg_bs_g_pet-supplies_d_sccl_40/262-6475623-0270327?psc=1","B09P1TXKDZ","https://images-eu.ssl-images-amazon.com/images/I/81y4ZfBvnML._AC_UL300_SR300,200_.jpg"
"#41","Whiskas Purrfectly Tuna & Salmon Wet Cat Food Pouches 85g x 24 Pieces","SAR 85.10","4.5","https://www.amazon.sa//-/en/Whiskas-Purrfectly-Salmon-Pouches-Pieces/dp/B08BTG6WNG/ref=zg_bs_g_pet-supplies_d_sccl_41/262-6475623-0270327?psc=1","B08BTG6WNG","https://images-eu.ssl-images-amazon.com/images/I/71pf7VRcT6L._AC_UL300_SR300,200_.jpg"
"#42","Amazon Basics Standard Dog Poop Bags With Dispenser and Leash Clip, Unscented, 300 Count, 20 Pack of 15, Black, 33 x 22.8 centimeters","SAR 17.00","4.8","https://www.amazon.sa//-/en/Amazon-Basics-Dispenser-Unscented-centimeters/dp/B00NABTC8M/ref=zg_bs_g_pet-supplies_d_sccl_42/262-6475623-0270327?psc=1","B00NABTC8M","https://images-eu.ssl-images-amazon.com/images/I/61AaxwRtBkL._AC_UL300_SR300,200_.jpg"
"#43","Kitekat Mackerel Cat Food - 1.4Kg","SAR 25.20","4.3","https://www.amazon.sa//-/en/Kitekat-Mackerel-Cat-Food-1-4Kg/dp/B077CLZCNG/ref=zg_bs_g_pet-supplies_d_sccl_43/262-6475623-0270327?psc=1","B077CLZCNG","https://images-eu.ssl-images-amazon.com/images/I/91XQ-6O-mRS._AC_UL300_SR300,200_.jpg"
"#44","Whiskas Kitten Ocean Fish Flavor with Milk, Dry Food for Kittens Aged 2-12 Months, Contains 41 Essential Nutrients Your Kitten Naturally Needs While Still Developing and Growing, 1.1kg","SAR 24.50","4.4","https://www.amazon.sa//-/en/Whiskas-Essential-Nutrients-Naturally-Developing/dp/B07P9FL78R/ref=zg_bs_g_pet-supplies_d_sccl_44/262-6475623-0270327?psc=1","B07P9FL78R","https://images-eu.ssl-images-amazon.com/images/I/61B27ocLwhL._AC_UL300_SR300,200_.jpg"
"#45","Purina Friskies Seafood Sensations Dry Cat Food 1.1 Kg","SAR 24.01","4.5","https://www.amazon.sa//-/en/Purina-Friskies-Seafood-Sensations-Food/dp/B01CCWPZ26/ref=zg_bs_g_pet-supplies_d_sccl_45/262-6475623-0270327?psc=1","B01CCWPZ26","https://images-eu.ssl-images-amazon.com/images/I/81ScRknl4zL._AC_UL300_SR300,200_.jpg"
"#46","itPlus Cat Grooming Brush, Self Cleaning Slicker Brushes for Dogs and Cats Pet Grooming Brush for Pet Massage-Self Cleaning, Assorted Colors","SAR 35.00","4.3","https://www.amazon.sa//-/en/itPlus-Grooming-Cleaning-Massage-Self-Assorted/dp/B08GWZ26PL/ref=zg_bs_g_pet-supplies_d_sccl_46/262-6475623-0270327?psc=1","B08GWZ26PL","https://images-eu.ssl-images-amazon.com/images/I/71Z3-5FnNsL._AC_UL300_SR300,200_.jpg"
"#47","DELOMO Pet Hair Remover - Lint Roller for Pet Hair - Cat and Dog Hair Remover for Couch, Furniture, Carpet, Car Seat, Reusable Roller W/Self-Cleaning Base - Upgraded Animal Fur Removal Tool","SAR 34.95","4.3","https://www.amazon.sa//-/en/DELOMO-Pet-Hair-Remover-Self-Cleaning/dp/B07ZKGVWVB/ref=zg_bs_g_pet-supplies_d_sccl_47/262-6475623-0270327?psc=1","B07ZKGVWVB","https://images-eu.ssl-images-amazon.com/images/I/71Dnw9bZOLL._AC_UL300_SR300,200_.jpg"
"#48","Cat Tree Pet Condo Furniture for Kittens Cat House Play Multifunctional Cat Climbing Cat Scratch Covered with Sisal and Elevated Cat Hammock (Beige)","SAR 139.00","4.0","https://www.amazon.sa//-/en/Furniture-Kittens-Multifunctional-Climbing-Elevated/dp/B0BVTCVH1Z/ref=zg_bs_g_pet-supplies_d_sccl_48/262-6475623-0270327?psc=1","B0BVTCVH1Z","https://images-eu.ssl-images-amazon.com/images/I/61-cNkrA7vL._AC_UL300_SR300,200_.jpg"
"#49","Pedigree Beef, Lamb and Vegetables Small Dog Food- 1.5kg","SAR 27.40","4.4","https://www.amazon.sa//-/en/Pedigree-Vegetables-Small-Food-1-5kg/dp/B07PRNMZMS/ref=zg_bs_g_pet-supplies_d_sccl_49/262-6475623-0270327?psc=1","B07PRNMZMS","https://images-eu.ssl-images-amazon.com/images/I/71oFtVKLNeL._AC_UL300_SR300,200_.jpg"
"#50","Purina Fancy Feast Royale Virgin Flaked Tuna Wet Cat Food Can, 24x85g","SAR 168.30","4.2","https://www.amazon.sa//-/en/Purina-Royale-Virgin-Flaked-24x85g/dp/B07YVK2NBS/ref=zg_bs_g_pet-supplies_d_sccl_50/262-6475623-0270327?psc=1","B07YVK2NBS","https://images-eu.ssl-images-amazon.com/images/I/811osCecXKL._AC_UL300_SR300,200_.jpg"
"#51","Lint Roller Pet Hair Remover Lint Remover Extra Sticky Roller 200 Sheets with 1 Upgraded Handle Lint Rollers for Pet Hair Lint Roller for Clothes","SAR 39.99","4.5","https://www.amazon.sa//-/en/Roller-Remover-Upgraded-Rollers-Clothes/dp/B0CG3QBWJS/ref=zg_bs_g_pet-supplies_d_sccl_1/262-6475623-0270327?psc=1","B0CG3QBWJS","https://images-eu.ssl-images-amazon.com/images/I/71nwg70C2UL._AC_UL600_SR600,400_.jpg"
"#52","Lolo Pets Foody Premium Complete Food for Budgie 500g","SAR 12.51","4.1","https://www.amazon.sa//-/en/Lolo-Pets-Premium-Complete-Budgie/dp/B0745L4VBZ/ref=zg_bs_g_pet-supplies_d_sccl_2/262-6475623-0270327?psc=1","B0745L4VBZ","https://images-eu.ssl-images-amazon.com/images/I/81q1H8cC-JL._AC_UL600_SR600,400_.jpg"
"#53","SKY-TOUCH Cat Tree Tower，Cat Condo with Sisal Scratching Post,circular rest activity center Cat Climbing Tree，Sisal Posts, and Rest Place for Indoor Cat（45×45×20cm）","SAR 39.90","3.9","https://www.amazon.sa//-/en/SKY-TOUCH-Tower%EF%BC%8CCat-Scratching-Tree%EF%BC%8CSisal-Cat%EF%BC%8845%C3%9745%C3%9720cm%EF%BC%89/dp/B0C5JSGPV7/ref=zg_bs_g_pet-supplies_d_sccl_3/262-6475623-0270327?psc=1","B0C5JSGPV7","https://images-eu.ssl-images-amazon.com/images/I/71ZMPovaYCL._AC_UL600_SR600,400_.jpg"
"#54","Duck Meat Bones For Small Breeds, 100 G","SAR 18.30","4.5","https://www.amazon.sa//-/en/Duck-Meat-Bones-Small-Breeds/dp/B0848CN9D4/ref=zg_bs_g_pet-supplies_d_sccl_4/262-6475623-0270327?psc=1","B0848CN9D4","https://images-eu.ssl-images-amazon.com/images/I/61aSbkcYXbL._AC_UL600_SR600,400_.jpg"
"#55","PROTON 2Pack Carbon Filters,2Pack Filters and 2 Pack 8D Filters for Cat Water Fountain Stainless Steel","SAR 30.00","4.3","https://www.amazon.sa//-/en/PROTON-Carbon-Filters-Fountain-Stainless/dp/B09Z6N49MM/ref=zg_bs_g_pet-supplies_d_sccl_5/262-6475623-0270327?psc=1","B09Z6N49MM","https://images-eu.ssl-images-amazon.com/images/I/81U+3jwATAL._AC_UL600_SR600,400_.jpg"
"#56","Avont Cat Recovery Suit Post Surgery, Elizabethan Collar & Cone Alternative, Kitten Onesie Pet Surgical Spay Shirt for Abdominal Wounds or Skin Diseases -Coral (M)","SAR 44.99","4.1","https://www.amazon.sa//-/en/Avont-Recovery-Elizabethan-Alternative-Abdominal/dp/B0BS8X2HY6/ref=zg_bs_g_pet-supplies_d_sccl_6/262-6475623-0270327?psc=1","B0BS8X2HY6","https://images-eu.ssl-images-amazon.com/images/I/71qiwVAzbgL._AC_UL600_SR600,400_.jpg"
"#57","AmazonBasics Small Gravity Pet Food Feeder and Water Dispenser Bundle","SAR 43.00","4.4","https://www.amazon.sa//-/en/AmazonBasics-Gravity-Feeder-Dispenser-Bundle/dp/B06ZZC83MG/ref=zg_bs_g_pet-supplies_d_sccl_7/262-6475623-0270327?psc=1","B06ZZC83MG","https://images-eu.ssl-images-amazon.com/images/I/81teYZ11DYL._AC_UL600_SR600,400_.jpg"
"#58","Sky-Touch Disposable Absorbent Quick Drying Leak-Proof Pee Pads For Potty Training For Pets, 60X60Cm L - 40 Pieces, Blue, L - 60X60Cm","SAR 28.40","4.3","https://www.amazon.sa//-/en/Sky-Touch-Disposable-Absorbent-Leak-Proof-Training/dp/B08CVNWZ84/ref=zg_bs_g_pet-supplies_d_sccl_8/262-6475623-0270327?psc=1","B08CVNWZ84","https://images-eu.ssl-images-amazon.com/images/I/81Z+h1o+TtL._AC_UL600_SR600,400_.jpg"
"#59","Royalist Adult Cat Food Chicken 2kg","SAR 49.61","4.7","https://www.amazon.sa//-/en/Royalist-Adult-Cat-Food-Chicken/dp/B0B4JFC563/ref=zg_bs_g_pet-supplies_d_sccl_9/262-6475623-0270327?psc=1","B0B4JFC563","https://images-eu.ssl-images-amazon.com/images/I/71KQqSp2QqL._AC_UL600_SR600,400_.jpg"
"#60","Felix Purina as Good as It Looks with Beef and Carrot in Jelly, 85g (Pack of 12)","SAR 54.95","4.6","https://www.amazon.sa//-/en/Felix-Purina-Looks-Carrot-Jelly/dp/B08YN294N3/ref=zg_bs_g_pet-supplies_d_sccl_10/262-6475623-0270327?psc=1","B08YN294N3","https://images-eu.ssl-images-amazon.com/images/I/81RU42oUGhL._AC_UL600_SR600,400_.jpg"
"#61","Catsan Hygiene Cat Litter, 10L","SAR 62.30","3.9","https://www.amazon.sa//-/en/Catsan-Hygiene-Cat-Litter-10L/dp/B001N00FUG/ref=zg_bs_g_pet-supplies_d_sccl_11/262-6475623-0270327?psc=1","B001N00FUG","https://images-eu.ssl-images-amazon.com/images/I/71fXBBiHI2L._AC_UL600_SR600,400_.jpg"
"#62","Cindy's Recipe Cat & Kitten Milk 250ml","SAR 11.01","4.5","https://www.amazon.sa//-/en/Cindys-Recipe-Kitten-Milk-250ml/dp/B0CJ9K2VRW/ref=zg_bs_g_pet-supplies_d_sccl_12/262-6475623-0270327?psc=1","B0CJ9K2VRW","https://images-eu.ssl-images-amazon.com/images/I/5188XS9rHxL._AC_UL600_SR600,400_.jpg"
"#63","Kit Cat Wet Wipes 5 in 1 Lavender Scented 80 pcs","SAR 28.15","4.6","https://www.amazon.sa//-/en/Kit-Cat-Wipes-Lavender-Scented/dp/B083WJKP4G/ref=zg_bs_g_pet-supplies_d_sccl_13/262-6475623-0270327?psc=1","B083WJKP4G","https://images-eu.ssl-images-amazon.com/images/I/818wLU8LkML._AC_UL600_SR600,400_.jpg"
"#64","PYPABL 3W Aquarium Air Pump, 300L/H Silent Adjustable Fish Tank Bubbler, Powerful Oxygen Pump for 1-450L Fish and Turtle Tank (Black Gray)","SAR 54.97","4.7","https://www.amazon.sa//-/en/PYPABL-Aquarium-Adjustable-Bubbler-Powerful/dp/B0C3LMRLTT/ref=zg_bs_g_pet-supplies_d_sccl_14/262-6475623-0270327?psc=1","B0C3LMRLTT","https://images-eu.ssl-images-amazon.com/images/I/71PWWrqFOiL._AC_UL600_SR600,400_.jpg"
"#65","JANA WORLD CAT LITTER APPLE PERFUME 20 kg","Price N/A","Rating N/A","https://www.amazon.sa//-/en/JANA-WORLD-LITTER-APPLE-PERFUME/dp/B0CP29GVD7/ref=zg_bs_g_pet-supplies_d_sccl_15/262-6475623-0270327?psc=1","B0CP29GVD7","https://images-eu.ssl-images-amazon.com/images/I/81kyCPJdThL._AC_UL600_SR600,400_.jpg"
"#66","Jiuhuazi Interactive Cat Ball Toy with 1 catnip mushroom toy, Intelligent Indoor Automatic Moving Ball Puzzle Dispel Boredom USB Charging Pet Toy","SAR 23.90","4.0","https://www.amazon.sa//-/en/Jiuhuazi-Interactive-mushroom-Intelligent-Automatic/dp/B0BJ1CZSVP/ref=zg_bs_g_pet-supplies_d_sccl_16/262-6475623-0270327?psc=1","B0BJ1CZSVP","https://images-eu.ssl-images-amazon.com/images/I/61N0DIiJA+L._AC_UL600_SR600,400_.jpg"
"#67","Cat Nail Clippers Baytion Pet Nail Clippers for small animals,Cat Claw Cutters Scissors for Guinea Pigs, Birds, Puppies, Kittens, Gerbils, Hamsters and Rabbits (Cat Nail Clipper)","SAR 15.99","4.5","https://www.amazon.sa//-/en/Clippers-Baytion-animals-Scissors-Hamsters/dp/B08Q3GVY8S/ref=zg_bs_g_pet-supplies_d_sccl_17/262-6475623-0270327?psc=1","B08Q3GVY8S","https://images-eu.ssl-images-amazon.com/images/I/61Fz5trQ0bL._AC_UL600_SR600,400_.jpg"
"#68","Eacam Pet Grooming Hair Clipper, Hair Cutter Low Noise Dog Cat Rabbit Hair Trimmer Cutter Baby Hair Clipper USB Rechargeable Cordless Shavers Electrical Pet Professional Grooming Machine Tool","SAR 34.99","4.5","https://www.amazon.sa//-/en/Grooming-Rechargeable-Cordless-Electrical-Professional/dp/B09GY13472/ref=zg_bs_g_pet-supplies_d_sccl_18/262-6475623-0270327?psc=1","B09GY13472","https://images-eu.ssl-images-amazon.com/images/I/61bMWYTEnhL._AC_UL600_SR600,400_.jpg"
"#69","Calcium Bones With Chicken For Small Breeds, 100 G","SAR 19.29","4.5","https://www.amazon.sa//-/en/Calcium-Bones-Chicken-Small-Breeds/dp/B0848K6C2Z/ref=zg_bs_g_pet-supplies_d_sccl_19/262-6475623-0270327?psc=1","B0848K6C2Z","https://images-eu.ssl-images-amazon.com/images/I/61NeT3Oo3eL._AC_UL600_SR600,400_.jpg"
