"rank","title","price","rating","link","SKU","image_link"
"#1","Intex 24 Inch Glossy Beach Ball - 59030","SAR 5.50","4.5","https://www.amazon.sa//-/en/Intex-Inch-Glossy-Beach-Ball/dp/B0007XC2ME/ref=zg_bs_g_toys_d_sccl_1/259-0867102-6637049?psc=1","B0007XC2ME","https://images-eu.ssl-images-amazon.com/images/I/51ZDu0xuBQL._AC_UL600_SR600,400_.jpg"
"#2","PicassoTiles 100Pc Set 100pc Magnet Building Tiles Clear Magnetic 3D Building Blocks Construction Playboards, Creativity beyond Imagination, Inspirational, Recreational, Educational Conventional","SAR 119.00","4.8","https://www.amazon.sa//-/en/PicassoTiles-Construction-Inspirational-Recreational-Conventional/dp/B00AU56C5W/ref=zg_bs_g_toys_d_sccl_2/259-0867102-6637049?psc=1","B00AU56C5W","https://images-eu.ssl-images-amazon.com/images/I/918hxj63oOL._AC_UL600_SR600,400_.jpg"
"#3","Montessori Toys for 1 to 3-Year-Old Boys Girls Toddlers, Wooden Sorting & Stacking Toys for Toddlers and Kids Preschool, Educational Toys, Color Recognition Stacker Shape Sorter, Learning Puzzles Gift","SAR 14.95","4.6","https://www.amazon.sa//-/en/Montessori-3-Year-Old-Preschool-Educational-Recognition/dp/B094D42LRN/ref=zg_bs_g_toys_d_sccl_3/259-0867102-6637049?psc=1","B094D42LRN","https://images-eu.ssl-images-amazon.com/images/I/71U06Q9P9YL._AC_UL600_SR600,400_.jpg"
"#4","DMG Baby Crawling Crab Musical Toy,Interactive Walking Dancing Toy with Music Sounds & Lights, Automatically Avoid Obstacles,USB Charging Cable Included,Fun Moving Toy for Babies,Toddlers and Kids (G)","SAR 35.99","4.3","https://www.amazon.sa//-/en/DMG-Crawling-Interactive-Automatically-Obstacles/dp/B09TFC5ZH2/ref=zg_bs_g_toys_d_sccl_4/259-0867102-6637049?psc=1","B09TFC5ZH2","https://images-eu.ssl-images-amazon.com/images/I/713NT0PA+xL._AC_UL600_SR600,400_.jpg"
"#5","YOYIKER Baby Wrist Rattles Toys 0-3-6-12 Months & Foot Sock Rattle Toy, Monkey, Elephant, 4 Pieces","SAR 15.00","4.4","https://www.amazon.sa//-/en/YOYIKER-Rattles-0-3-6-12-Months-Elephant/dp/B08P7G8QZP/ref=zg_bs_g_toys_d_sccl_5/259-0867102-6637049?psc=1","B08P7G8QZP","https://images-eu.ssl-images-amazon.com/images/I/61Pdz05zYBL._AC_UL600_SR600,400_.jpg"
"#6","MINGKIDS Montessori Toys for 1 Year Old,Baby Sorter Toy Colorful Cube and 6 Pcs Multi Sensory Shape, Toddler Developmental Learning Toys Birthday Gifts,Baby Toys 6-12-18 Months","SAR 19.88","4.6","https://www.amazon.sa//-/en/MINGKIDS-Montessori-Colorful-Developmental-Learning/dp/B09BB1VS14/ref=zg_bs_g_toys_d_sccl_6/259-0867102-6637049?psc=1","B09BB1VS14","https://images-eu.ssl-images-amazon.com/images/I/61ets3sXmbL._AC_UL600_SR600,400_.jpg"
"#7","Jackaroo Wooden Board Game for 4 Players With Glass Marbles and Cards, Size 39X39 cm, Black","SAR 55.00","4.4","https://www.amazon.sa//-/en/Jackaroo-Wooden-Board-Players-Marbles/dp/B0CQJYX7BT/ref=zg_bs_g_toys_d_sccl_7/259-0867102-6637049?psc=1","B0CQJYX7BT","https://images-eu.ssl-images-amazon.com/images/I/715rYmfeQOL._AC_UL600_SR600,400_.jpg"
"#8","UNIH Hammer and Ball Drop Toys for 1 Year Old Boy Girl Infant Gifts - Pound a Ball Toddler Toys - Baby Toys for 6 to 12-18 Months","SAR 21.00","4.4","https://www.amazon.sa//-/en/UNIH-Hammer-Ball-Infant-Gifts/dp/B08FDN1VSR/ref=zg_bs_g_toys_d_sccl_8/259-0867102-6637049?psc=1","B08FDN1VSR","https://images-eu.ssl-images-amazon.com/images/I/61bndkTtoXL._AC_UL600_SR600,400_.jpg"
"#9","Arabest Kids Tool Kit, Wooden Tool Box, Construction Playset, Educational STEM Construction Toys, Ramadan Birthday Gifts for 2-6 Years Old Toddler Boys Girls (Cartoon)","SAR 57.92","4.4","https://www.amazon.sa//-/en/Arabest-Construction-Playset-Educational-Birthday/dp/B09TZX2C2K/ref=zg_bs_g_toys_d_sccl_9/259-0867102-6637049?psc=1","B09TZX2C2K","https://images-eu.ssl-images-amazon.com/images/I/71GUpj46M7L._AC_UL600_SR600,400_.jpg"
"#10","Soft Plastic Ocean Ball Toys - 50 Pieces","SAR 28.98","4.3","https://www.amazon.sa//-/en/Soft-Plastic-Ocean-Ball-Toys/dp/B0839Q3QY4/ref=zg_bs_g_toys_d_sccl_10/259-0867102-6637049?psc=1","B0839Q3QY4","https://images-eu.ssl-images-amazon.com/images/I/71-6alXOg6L._AC_UL600_SR600,400_.jpg"
"#11","SKY-TOUCH 4 in 1 Kids Balance Bike Kids Tricycles for 1-4 Years, Toddlers Trike with Adjustable Seat Indoor Outdoor, Boys Girls Kids First Birthday Gifts Pink","SAR 106.40","3.7","https://www.amazon.sa//-/en/SKY-TOUCH-Tricycles-Toddlers-Adjustable-Birthday/dp/B0BC2KGMYL/ref=zg_bs_g_toys_d_sccl_11/259-0867102-6637049?psc=1","B0BC2KGMYL","https://images-eu.ssl-images-amazon.com/images/I/61MPzceLrtL._AC_UL600_SR600,400_.jpg"
"#12","Unicorn Gifts for Girls - Unicorn Terrarium Kit for Kids -Unicorn Toys for Girls- Birthday Gift for Girls Ages 4 5 6 7 8 12 Year Old- Arts and Crafts Supplies for Kids-Best Present for Girl","SAR 89.10","5.0","https://www.amazon.sa//-/en/Unicorn-Gifts-Girls-Terrarium-Kids-Best/dp/B0CQV3QBCQ/ref=zg_bs_g_toys_d_sccl_12/259-0867102-6637049?psc=1","B0CQV3QBCQ","https://images-eu.ssl-images-amazon.com/images/I/81yTtNjW5lL._AC_UL600_SR600,400_.jpg"
"#13","UNO FLIP!™ Card Game Tin","SAR 23.99","4.6","https://www.amazon.sa//-/en/UNO-FLIP-Card-Game-Tin/dp/B07JKB2H59/ref=zg_bs_g_toys_d_sccl_13/259-0867102-6637049?psc=1","B07JKB2H59","https://images-eu.ssl-images-amazon.com/images/I/817MubHY4ZL._AC_UL600_SR600,400_.jpg"
"#14","SKY-TOUCH Baby Montessori Toys : Toddlers Sensory Toys with Food Grade Silicone Pull String Activity Toy Developing Fine Motor Skills Toys for 18 Months+ Baby Gifts","SAR 22.16","4.7","https://www.amazon.sa//-/en/SKY-TOUCH-Baby-Montessori-Toys-Developing/dp/B0CR15P352/ref=zg_bs_g_toys_d_sccl_14/259-0867102-6637049?psc=1","B0CR15P352","https://images-eu.ssl-images-amazon.com/images/I/61WtTAhoJqL._AC_UL600_SR600,400_.jpg"
"#15","WAMBORY Kids Makeup Sets for Girls, Cosmetic Make Up Kit with Beauty Cosmetic Bag, Kids Washable Play Makeup Non Toxic Toys Gifts for Little Princess Birthday Party Children","SAR 45.50","4.6","https://www.amazon.sa//-/en/WAMBORY-Cosmetic-Washable-Princess-Birthday/dp/B0B7LRGVP5/ref=zg_bs_g_toys_d_sccl_15/259-0867102-6637049?psc=1","B0B7LRGVP5","https://images-eu.ssl-images-amazon.com/images/I/81v3pwIk6dL._AC_UL600_SR600,400_.jpg"
"#16","Arabest Drilling Toys, Creative Mosaic Drill Set for Kids 4-8 Years Old, Electric Drill and Screw Puzzle Set for Kids, Playhouse Building Toys for Girls and Boys","SAR 56.40","4.5","https://www.amazon.sa//-/en/Arabest-Drilling-Creative-Electric-Playhouse/dp/B09V162CDQ/ref=zg_bs_g_toys_d_sccl_16/259-0867102-6637049?psc=1","B09V162CDQ","https://images-eu.ssl-images-amazon.com/images/I/717Knbr+J7L._AC_UL600_SR600,400_.jpg"
"#17","KIDWILL Wireless Bluetooth Karaoke Microphone for Kids, 5-in-1 Portable Handheld Karaoke Mic Speaker Player Recorder with Adjustable Remix FM Radio for Kids Girls Boys Teens Birthday (Black)","SAR 24.00","3.4","https://www.amazon.sa//-/en/KIDWILL-Wireless-Bluetooth-Microphone-Adjustable/dp/B08DHGFWBP/ref=zg_bs_g_toys_d_sccl_17/259-0867102-6637049?psc=1","B08DHGFWBP","https://images-eu.ssl-images-amazon.com/images/I/71aZ4Zg0JdL._AC_UL600_SR600,400_.jpg"
"#18","DMG 4 Pack Cartoon Water Coloring Magic Book With Water Pen, Water Coloring Magic Book Toddlers Kids Reusable Painting Unicorn Animal Cartoon Coloring Book Boys Girls Educational Learning Toys Gifts","SAR 26.10","4.4","https://www.amazon.sa//-/en/DMG-Coloring-Toddlers-Reusable-Educational/dp/B0BPC363FV/ref=zg_bs_g_toys_d_sccl_18/259-0867102-6637049?psc=1","B0BPC363FV","https://images-eu.ssl-images-amazon.com/images/I/81tGdpiSheL._AC_UL600_SR600,400_.jpg"
"#19","Kids Makeup Kit for Girls, Unicorn Makeup Set, Real Washable Make up Kit for Little Girl Princess Toddler Makeup for Kid Birthday Gifts Unicorn Toys for Girls 3 4 5 6 7 8 9 10 Year Old","SAR 76.50","4.7","https://www.amazon.sa//-/en/Unicorn-Washable-Princess-Toddler-Birthday/dp/B0C4XZKYLS/ref=zg_bs_g_toys_d_sccl_19/259-0867102-6637049?psc=1","B0C4XZKYLS","https://images-eu.ssl-images-amazon.com/images/I/81mU9hpNn5L._AC_UL600_SR600,400_.jpg"
"#20","DMG Kids Teepee, Play Tent Foldable Canvas Kids Playhouse Portable Teepee Tent for Kids to Play Indoor and Outdoor Made of 1.6m Platane Wood Support and Linen Fabric (White)","SAR 85.50","3.8","https://www.amazon.sa//-/en/DMG-Foldable-Playhouse-Portable-Outdoor/dp/B0B8YTT4P5/ref=zg_bs_g_toys_d_sccl_20/259-0867102-6637049?psc=1","B0B8YTT4P5","https://images-eu.ssl-images-amazon.com/images/I/41+tWZTRNbL._AC_UL600_SR600,400_.jpg"
"#21","50 BALLS multi colorTents","SAR 19.90","3.5","https://www.amazon.sa//-/en/Other-50-BALLS-multi-colorTents/dp/B081VFXQZN/ref=zg_bs_g_toys_d_sccl_21/259-0867102-6637049?psc=1","B081VFXQZN","https://images-eu.ssl-images-amazon.com/images/I/71ESu-pc7sL._AC_UL600_SR600,400_.jpg"
"#22","Get Wild 4 Uno!","SAR 20.00","4.7","https://www.amazon.sa//-/en/CN-UNO-W2087-Get-Wild/dp/B005I5M2F8/ref=zg_bs_g_toys_d_sccl_22/259-0867102-6637049?psc=1","B005I5M2F8","https://images-eu.ssl-images-amazon.com/images/I/71IC1KLr+uL._AC_UL600_SR600,400_.jpg"
"#23","Ufanore 6-in-1 STEM Projects for Kids Age 8-16, Solar Robot Kit Science Educational Set, DIY Building Toys Gift for Boys and Girls Age 8 9 10 11 12 13 14 15 16 Years Old, Solar and Battery Powered","SAR 59.70","3.9","https://www.amazon.sa//-/en/Ufanore-Projects-Science-Educational-Building/dp/B0BQ388XWV/ref=zg_bs_g_toys_d_sccl_23/259-0867102-6637049?psc=1","B0BQ388XWV","https://images-eu.ssl-images-amazon.com/images/I/718EpXnOo5L._AC_UL600_SR600,400_.jpg"
"#24","Ricjurzzty Kids Fireman Costume for Boys & Girls Pretend Play Fireman Gear Firefighter Costume Set for Kids Ages 3 & Up","Price N/A","Rating N/A","https://www.amazon.sa//-/en/Ricjurzzty-Fireman-Costume-Pretend-Firefighter/dp/B0CQCVSTBT/ref=zg_bs_g_toys_d_sccl_24/259-0867102-6637049?psc=1","B0CQCVSTBT","https://images-eu.ssl-images-amazon.com/images/I/61D3BNDzAUL._AC_UL600_SR600,400_.jpg"
"#25","Kids Makeup Kit for Girls, Washable Make Up Set 32pcs Toy for Kids Girls Makeup for Children, Kids Makeup Sets for Girls Birthday Gifts for 5 6 7 8 9 10 Year Old Girls Tiokkss","SAR 59.00","4.5","https://www.amazon.sa//-/en/Makeup-Washable-Children-Birthday-Tiokkss/dp/B0BTKKN5XW/ref=zg_bs_g_toys_d_sccl_25/259-0867102-6637049?psc=1","B0BTKKN5XW","https://images-eu.ssl-images-amazon.com/images/I/81kKu67EfYL._AC_UL600_SR600,400_.jpg"
"#26","Mumoo Bear Wooden Kitchen Toys Cutting Fruits Vegetables Colorful Pretend Play Baby Puzzle Toys Children Early Educational Magic Stickers","SAR 30.80","4.6","https://www.amazon.sa//-/en/Mumoo-Bear-Vegetables-Colorful-Educational/dp/B07NF9L73Q/ref=zg_bs_g_toys_d_sccl_26/259-0867102-6637049?psc=1","B07NF9L73Q","https://images-eu.ssl-images-amazon.com/images/I/61Bp2zLL7QL._AC_UL600_SR600,400_.jpg"
"#27","SUCITY 7000 Pcs Glass Seed Beads, Letter Beads Kit for Bracelets Making, 4mm DIY Bracelet Beads Alphabet Beads for Necklace Earring Bracelet Jewelry Making","SAR 9.99","4.5","https://www.amazon.sa//-/en/SUCITY-Bracelets-Bracelet-Alphabet-Necklace/dp/B09TF3C9VN/ref=zg_bs_g_toys_d_sccl_27/259-0867102-6637049?psc=1","B09TF3C9VN","https://images-eu.ssl-images-amazon.com/images/I/710IWKtbXhL._AC_UL600_SR600,400_.jpg"
"#28","Car Adventure Toys, Kids Race Track Toys for 3 4 5 6 7 Years Old Boys Girls, Puzzle Rail Car, City Rescue Toy w/ 4 Mini Cars, Preschool Educational Toys for Toddlers","SAR 55.17","4.5","https://www.amazon.sa//-/en/Adventure-Puzzle-Preschool-Educational-Toddlers/dp/B09Z2K37HG/ref=zg_bs_g_toys_d_sccl_28/259-0867102-6637049?psc=1","B09Z2K37HG","https://images-eu.ssl-images-amazon.com/images/I/71xIWk-iuqL._AC_UL600_SR600,400_.jpg"
"#29","12 Pack Wooden Puzzles Toddler Toys for Kids 1-3 Years Old, Jigsaw Puzzles Learning Toys for Boys and Girls, Montessori Toys Color Shapes Early Learning Educational Gift","SAR 45.99","4.5","https://www.amazon.sa//-/en/Puzzles-Toddler-Learning-Montessori-Educational/dp/B0B1PBNVY5/ref=zg_bs_g_toys_d_sccl_29/259-0867102-6637049?psc=1","B0B1PBNVY5","https://images-eu.ssl-images-amazon.com/images/I/71TdmUUjd4L._AC_UL600_SR600,400_.jpg"
"#30","ZEALOVE Christmas Adult Stich Onesie Animal Pajamas Cosplay Costumes Party Wear","SAR 100.00","4.1","https://www.amazon.sa//-/en/Onesie-Pajamas-Christmas-Cosplay-Costumes/dp/B08CXQSHJV/ref=zg_bs_g_toys_d_sccl_30/259-0867102-6637049?psc=1","B08CXQSHJV","https://images-eu.ssl-images-amazon.com/images/I/8156yAsHqqL._AC_UL600_SR600,400_.jpg"
"#31","Montessori Toys for 1 2 3 Year Old Boys Girls Gifts, Wooden Sorting and Stacking Toys for Toddlers 1-3, Educational Learning Toys for Preschool Kids, Color Recognition Shape Sorter Puzzles for Baby","SAR 13.45","4.4","https://www.amazon.sa//-/en/Montessori-Stacking-Educational-Preschool-Recognition/dp/B09BFC9QT1/ref=zg_bs_g_toys_d_sccl_31/259-0867102-6637049?psc=1","B09BFC9QT1","https://images-eu.ssl-images-amazon.com/images/I/712IKZl5xUL._AC_UL300_SR300,200_.jpg"
"#32","LEGO® Technic™ Monster Jam™ Monster Mutt™ Dalmatian 42150 Building Toy Set (244 Pieces)","SAR 75.63","4.7","https://www.amazon.sa//-/en/TechnicTM-Monster-Dalmatian-42150-Building/dp/B0BBRXFL11/ref=zg_bs_g_toys_d_sccl_32/259-0867102-6637049?psc=1","B0BBRXFL11","https://images-eu.ssl-images-amazon.com/images/I/61B+ITLXNXL._AC_UL300_SR300,200_.jpg"
"#33","30 Pack Spring Rainbow Magic Fidget Stress Coil Mini Springs Bulk Toys for Party Favor Carnival Prize Birthday Goodie Bag Stuffers for Kids Boys Girls…","SAR 30.99","4.6","https://www.amazon.sa//-/en/Rainbow-Springs-Carnival-Birthday-Stuffers/dp/B09FG5KWBC/ref=zg_bs_g_toys_d_sccl_33/259-0867102-6637049?psc=1","B09FG5KWBC","https://images-eu.ssl-images-amazon.com/images/I/714jP9vKITL._AC_UL300_SR300,200_.jpg"
"#34","Ball Drop and Roll Swirling Tower for Baby and Toddler Development Educational Toys, Birthday Gifts for 1 2 Year Old Boys and Girls Activity Toys","SAR 31.00","4.3","https://www.amazon.sa//-/en/Swirling-Development-Educational-Birthday-Activity/dp/B09CTVLD5M/ref=zg_bs_g_toys_d_sccl_34/259-0867102-6637049?psc=1","B09CTVLD5M","https://images-eu.ssl-images-amazon.com/images/I/61hnoL3RgaL._AC_UL300_SR300,200_.jpg"
"#35","LEGO Creator 3 in 1 Space Shuttle, Astronaut and Spaceship, Building Block Kids Toy, Age 6+, 31134 (144 pieces)","SAR 38.59","4.7","https://www.amazon.sa//-/en/LEGO-Astronaut-Spaceship-Building-31134/dp/B0BBRYHTPS/ref=zg_bs_g_toys_d_sccl_35/259-0867102-6637049?psc=1","B0BBRYHTPS","https://images-eu.ssl-images-amazon.com/images/I/61XOnisfcfL._AC_UL300_SR300,200_.jpg"
"#36","E88 Pro Drone 4k With High Definition Camera WiFi Foldable Drone 2.4G 6 Axis RC Altitude Hold - Gray","SAR 275.00","Rating N/A","https://www.amazon.sa//-/en/Drone-Definition-Camera-Foldable-Altitude/dp/B0BZHKYGN8/ref=zg_bs_g_toys_d_sccl_36/259-0867102-6637049?psc=1","B0BZHKYGN8","https://images-eu.ssl-images-amazon.com/images/I/61ePpJuFtAL._AC_UL300_SR300,200_.jpg"
"#37","110 PCS TCG Deck Box Including Poke Gold Foil Card Pack Assorted Cards (43 GX Rare 17 V Series Cards 28 Vmax Rares,6 EX Card, 7 Common Card, 7 Tag Cosplay Cards, 1 DX and 1 Mystery Card)(Not original)","SAR 50.00","4.6","https://www.amazon.sa//-/en/Including-Assorted-Cosplay-Mystery-original/dp/B0BZ86VB51/ref=zg_bs_g_toys_d_sccl_37/259-0867102-6637049?psc=1","B0BZ86VB51","https://images-eu.ssl-images-amazon.com/images/I/81AL4qlKgKL._AC_UL300_SR300,200_.jpg"
"#38","Play-Doh 8-Pack Rainbow Non-Toxic Modeling Compound With 8 Colors","SAR 39.57","4.4","https://www.amazon.sa//-/en/Play-Doh-Rainbow-Non-Toxic-Modeling-Compound/dp/B07NBR59QV/ref=zg_bs_g_toys_d_sccl_38/259-0867102-6637049?psc=1","B07NBR59QV","https://images-eu.ssl-images-amazon.com/images/I/61NWD100lXL._AC_UL300_SR300,200_.jpg"
"#39","SYOSI Rubix Cube, Speed Cube Smooth Turning Magic Cube 3x3x3 Brain Teaser Puzzle Cube Sticker (2.2 inches)","SAR 18.00","4.1","https://www.amazon.sa//-/en/SYOSI-Smooth-Turning-Teaser-Sticker/dp/B0BLKQ5LYH/ref=zg_bs_g_toys_d_sccl_39/259-0867102-6637049?psc=1","B0BLKQ5LYH","https://images-eu.ssl-images-amazon.com/images/I/716SaA6qJrL._AC_UL300_SR300,200_.jpg"
"#40","Around the bed stroller playing toy crib lathe hanging baby rattles mobile","SAR 16.89","4.4","https://www.amazon.sa//-/en/Around-stroller-playing-hanging-rattles/dp/B07MVW883P/ref=zg_bs_g_toys_d_sccl_40/259-0867102-6637049?psc=1","B07MVW883P","https://images-eu.ssl-images-amazon.com/images/I/61hdJpxAZxL._AC_UL300_SR300,200_.jpg"
"#41","SCIENISH 3 in 1 Kids Play Tent with Play Tunnel, Ball Pit, Basketball Hoop for Boys & Girls, Toddler Pop Up Playhouse Toy for Baby Indoor/Outdoor, Gift for Year Old Child (Blue)","SAR 67.90","3.8","https://www.amazon.sa//-/en/SCIENISH-Basketball-Toddler-Playhouse-Outdoor/dp/B0BZV42XSW/ref=zg_bs_g_toys_d_sccl_41/259-0867102-6637049?psc=1","B0BZV42XSW","https://images-eu.ssl-images-amazon.com/images/I/81e-b-btWSL._AC_UL300_SR300,200_.jpg"
"#42","Stretchy Bendable Man (36 Pack) Assorted Fun Colors, A Sticky, Stretchable, Slimy, Gooey Texture, Toy for Stress Anxiety Relief, Great Party Favor, Stocking Stuffer","SAR 25.86","4.4","https://www.amazon.sa//-/en/Stretchy-Bendable-Assorted-Stretchable-Stocking/dp/B07L9JSHNG/ref=zg_bs_g_toys_d_sccl_42/259-0867102-6637049?psc=1","B07L9JSHNG","https://images-eu.ssl-images-amazon.com/images/I/81eM8vE8vdL._AC_UL300_SR300,200_.jpg"
"#43","Children's Slide Indoor Household Small Kids Slide for Toddlers Folding Indoor Freestanding Slide Easy Assemble Children Climber Playset Toy Climber Freestanding Toddler Slide Basketball Hoop (Blue)","SAR 165.00","4.5","https://www.amazon.sa//-/en/Childrens-Household-Toddlers-Freestanding-Basketball/dp/B0CQR6H1W6/ref=zg_bs_g_toys_d_sccl_43/259-0867102-6637049?psc=1","B0CQR6H1W6","https://images-eu.ssl-images-amazon.com/images/I/51qbtHHU9SL._AC_UL300_SR300,200_.jpg"
"#44","SCIENISH Video Game Console, Built-in 10000+ Games, Retro handheld Game Console, 4K High Definition HDMI Output for TV with Dual 2.4G Wireless Controllers For Kids Gift(64G)","SAR 69.90","2.9","https://www.amazon.sa//-/en/SCIENISH-handheld-Definition-Wireless-Controllers/dp/B0C7VHGGY8/ref=zg_bs_g_toys_d_sccl_44/259-0867102-6637049?psc=1","B0C7VHGGY8","https://images-eu.ssl-images-amazon.com/images/I/71-6BxmQg7L._AC_UL300_SR300,200_.jpg"
"#45","Hasbro Monopoly Game, Classic Family Board Game for 2 to 6 Players, for Kids Ages 8 and Up","SAR 88.53","4.6","https://www.amazon.sa//-/en/Hasbro-Monopoly-Classic-Family-Players/dp/B07MXGL3ZW/ref=zg_bs_g_toys_d_sccl_45/259-0867102-6637049?psc=1","B07MXGL3ZW","https://images-eu.ssl-images-amazon.com/images/I/71VOSLOz4+L._AC_UL300_SR300,200_.jpg"
"#46","SKY-TOUCH Electric Runaway Crab，Crawling Crab Baby Toy with Music and LED Light Up，Toddler Interactive Learning Development Toy with Automatically Avoid Obstacles，For Babies, Toddlers and Kids","SAR 29.90","4.3","https://www.amazon.sa//-/en/SKY-TOUCH-Runaway-Crab%EF%BC%8CCrawling-Crab-Automatically/dp/B0BFVL295N/ref=zg_bs_g_toys_d_sccl_46/259-0867102-6637049?psc=1","B0BFVL295N","https://images-eu.ssl-images-amazon.com/images/I/51CFO8wwKPL._AC_UL300_SR300,200_.jpg"
"#47","سيارة كهربائية للأطفال 1 مطور","SAR 270.00","3.1","https://www.amazon.sa//-/en/%D8%B3%D9%8A%D8%A7%D8%B1%D8%A9-%D9%83%D9%87%D8%B1%D8%A8%D8%A7%D8%A6%D9%8A%D8%A9-%D9%84%D9%84%D8%A3%D8%B7%D9%81%D8%A7%D9%84-1-%D9%85%D8%B7%D9%88%D8%B1/dp/B0CK5XDJLY/ref=zg_bs_g_toys_d_sccl_47/259-0867102-6637049?psc=1","B0CK5XDJLY","https://images-eu.ssl-images-amazon.com/images/I/51coUC-QSWL._AC_UL300_SR300,200_.jpg"
"#48","other AM ANNA Kid's Wooden Building Blocks Eductional Toys,red","SAR 20.00","4.3","https://www.amazon.sa//-/en/other-Wooden-Building-Blocks-Eductional/dp/B07NF97YQX/ref=zg_bs_g_toys_d_sccl_48/259-0867102-6637049?psc=1","B07NF97YQX","https://images-eu.ssl-images-amazon.com/images/I/51SjBBVnhLL._AC_UL300_SR300,200_.jpg"
"#49","Wooden Collage Sort Toys Educational Colors Discrimination Toys for Toddlers Development","SAR 10.00","4.1","https://www.amazon.sa//-/en/Collage-Educational-Discrimination-Toddlers-Development/dp/B07MXJ1BN1/ref=zg_bs_g_toys_d_sccl_49/259-0867102-6637049?psc=1","B07MXJ1BN1","https://images-eu.ssl-images-amazon.com/images/I/712c5-ENIeL._AC_UL300_SR300,200_.jpg"
"#50","Learning Resources LSP0949-UK MathLink Cubes Numberblocks 1-10 Activity Set, Early Years Maths Learning, Build, Learn & Play in The Classroom & at Home.","SAR 112.64","4.7","https://www.amazon.sa//-/en/Learning-Resources-LSP0949-UK-Numberblocks-Classroom/dp/B08N55DKJ6/ref=zg_bs_g_toys_d_sccl_50/259-0867102-6637049?psc=1","B08N55DKJ6","https://images-eu.ssl-images-amazon.com/images/I/71W1j76yVtL._AC_UL300_SR300,200_.jpg"
"#51","iShyan Crocodile Teeth Toys Game for Kids, Crocodile Biting Finger Dentist Games Funny Toys, 2020 Version Ages 4 and Up","SAR 19.50","3.5","https://www.amazon.sa//-/en/iShyan-Crocodile-Biting-Dentist-Version/dp/B07NZ3M6S5/ref=zg_bs_g_toys_d_sccl_1/259-0867102-6637049?psc=1","B07NZ3M6S5","https://images-eu.ssl-images-amazon.com/images/I/613LeHTw6yL._AC_UL600_SR600,400_.jpg"
"#52","Ohuhu Marker Pads Art Sketchbook, 7.6""x10"" Large Paper Size, 120LB/200GSM Heavy Smooth Drawing Papers, 60 Sheets/120 Pages, Spiral Bound Sketch Book for Alcohol Markers Gift","SAR 47.99","4.8","https://www.amazon.sa//-/en/Ohuhu-Sketchbook-Drawing-Alcohol-Markers/dp/B089GJWYL7/ref=zg_bs_g_toys_d_sccl_2/259-0867102-6637049?psc=1","B089GJWYL7","https://images-eu.ssl-images-amazon.com/images/I/71yH1DlG9CL._AC_UL600_SR600,400_.jpg"
"#53","Children's Drawing Roll, Coloring Paper Roll for Kids, Drawing Paper Roll DIY Sticky Color Filling Paper, 11.8 * 118 Inches Sticky Drawing Paper Roll (Animal World)","SAR 29.99","4.3","https://www.amazon.sa//-/en/Childrens-Drawing-Coloring-Sticky-Filling/dp/B0CBSMJSYS/ref=zg_bs_g_toys_d_sccl_3/259-0867102-6637049?psc=1","B0CBSMJSYS","https://images-eu.ssl-images-amazon.com/images/I/71ajgykkE9L._AC_UL600_SR600,400_.jpg"
"#54","S-012 RC Stunt Car Remote Control Watch Gesture Sensor Deformable Electric Toy Cars All Terrain Speed 2.4GHz 4WD 360Rotation Whirligig Off-road Vehicle Gift for Kids Boys Birthday","SAR 66.07","3.4","https://www.amazon.sa//-/en/Deformable-Electric-360Rotation-Whirligig-Off-road/dp/B09CV5SW7Z/ref=zg_bs_g_toys_d_sccl_4/259-0867102-6637049?psc=1","B09CV5SW7Z","https://images-eu.ssl-images-amazon.com/images/I/71AehdciQ1S._AC_UL600_SR600,400_.jpg"
"#55","ToyWorld PUBG Hand Gun (Pistol) without Brief Case Toy - Black","SAR 12.49","2.9","https://www.amazon.sa//-/en/ToyWorld-PUBG-Pistol-without-Brief/dp/B09LM3NSHC/ref=zg_bs_g_toys_d_sccl_5/259-0867102-6637049?psc=1","B09LM3NSHC","https://images-eu.ssl-images-amazon.com/images/I/51xqa6VZZgL._AC_UL600_SR600,400_.jpg"
"#56","Ohuhu Marker Pads Art Sketchbook, 8.9""x 8.3"" Portable Square Size, 120 LB/200 Gsm Drawing Papers, 60 Sheets/120 Pages, Spiral Bound Sketch Book, Specially Designed For Alcohol Markers","SAR 47.98","4.7","https://www.amazon.sa//-/en/Ohuhu-Sketchbook-Portable-Specially-Designed/dp/B089GKDK9R/ref=zg_bs_g_toys_d_sccl_6/259-0867102-6637049?psc=1","B089GKDK9R","https://images-eu.ssl-images-amazon.com/images/I/71JG1Zie4QL._AC_UL600_SR600,400_.jpg"
"#57","Playmate 4 Pack Monster Truck Toys for Boys and Girls, Inertia Car Educational Toy Cars, Friction Powered Push and Go Toy Cars, Christmas Gift Birthday Party Supplies for Toddlers Kids (4 Color)","SAR 39.99","4.4","https://www.amazon.sa//-/en/Playmate-Educational-Friction-Christmas-Birthday/dp/B08NWTGTX4/ref=zg_bs_g_toys_d_sccl_7/259-0867102-6637049?psc=1","B08NWTGTX4","https://images-eu.ssl-images-amazon.com/images/I/718YpgdrLZL._AC_UL600_SR600,400_.jpg"
"#58","ECVV Math Manipulatives for Kids Ages 3-8 | Linking Snap Cubes for Kindergarten & Elementary Counting Skills | Fun Learning Activities for School, Classroom, and Home | 100 Piece Cube Set, 10 Colors","SAR 25.17","4.4","https://www.amazon.sa//-/en/ECVV-Manipulatives-Kindergarten-Elementary-Activities/dp/B09KP1DJJJ/ref=zg_bs_g_toys_d_sccl_8/259-0867102-6637049?psc=1","B09KP1DJJJ","https://images-eu.ssl-images-amazon.com/images/I/71-naeYk+KL._AC_UL600_SR600,400_.jpg"
"#59","RC Stunt Car, 4WD 2.4GHz Remote Control Gesture Sensor Toy Cars, 360° Rotating Off Road Vehicle with Lights Music & Spray Launcher, Toy Cars for kids","SAR 87.95","4.1","https://www.amazon.sa//-/en/Control-Gesture-Rotating-Vehicle-Launcher/dp/B0B3TF1GLX/ref=zg_bs_g_toys_d_sccl_9/259-0867102-6637049?psc=1","B0B3TF1GLX","https://images-eu.ssl-images-amazon.com/images/I/71eCX8cYqJL._AC_UL600_SR600,400_.jpg"
"#60","UNO FLIP! Family Card Game, with 112 Cards in a Sturdy Storage Tin, Makes a Great Gift for 7 Year Olds [Amazon Exclusive]","SAR 31.99","4.1","https://www.amazon.sa//-/en/Family-Sturdy-Storage-Amazon-Exclusive/dp/B07P8WVZ5D/ref=zg_bs_g_toys_d_sccl_10/259-0867102-6637049?psc=1","B07P8WVZ5D","https://images-eu.ssl-images-amazon.com/images/I/81NvSNENkwL._AC_UL600_SR600,400_.jpg"
"#61","Sausiry Dancing, Singing and Shaking Cactus Plush Toy- Repeat Whatever You Said, With 120 English Songs for Kids (No Batteries)","SAR 29.99","3.6","https://www.amazon.sa//-/en/Sausiry-Dancing-Singing-Whatever-Batteries/dp/B09B6XPM77/ref=zg_bs_g_toys_d_sccl_11/259-0867102-6637049?psc=1","B09B6XPM77","https://images-eu.ssl-images-amazon.com/images/I/7164CFXaCZL._AC_UL600_SR600,400_.jpg"
"#62","Wooden Montessori Toys for Toddlers Learning Activities Sorting Box Educational Toys Preschool Kindergarten Games Autism Toys Motor Skills STEM for Girls Boys Age 1-2 2 3 4 Year Old Kids Birthday Gift","SAR 38.00","4.4","https://www.amazon.sa//-/en/Montessori-Activities-Educational-Preschool-Kindergarten/dp/B08727BB1C/ref=zg_bs_g_toys_d_sccl_12/259-0867102-6637049?psc=1","B08727BB1C","https://images-eu.ssl-images-amazon.com/images/I/81TaBas+vXL._AC_UL600_SR600,400_.jpg"
