"rank","title","price","rating","link","SKU","image_link"
"#63","Montessori Learning Toys Slide Puzzle Color & Shape Matching Brain Teasers Logic Game Preschool Educational Wooden Toys for Kids Boys Girls Age 3 4 5 6 7 Years Old Travel Toys Birthday Gifts for Kids","SAR 28.00","4.6","https://www.amazon.sa//-/en/Montessori-Learning-Matching-Preschool-Educational/dp/B07XHM4GF8/ref=zg_bs_g_toys_d_sccl_13/259-0867102-6637049?psc=1","B07XHM4GF8","https://images-eu.ssl-images-amazon.com/images/I/61QgdqD6aaL._AC_UL600_SR600,400_.jpg"
"#64","SKY-TOUCH Around The Bed Stroller Playing Toy Crib Lathe Hanging Baby Rattles，Mobile Baby Spiral Activity Hanging Toys, Stroller Toys Cart Seat Pram Toy,Baby Worm","SAR 16.00","3.9","https://www.amazon.sa//-/en/SKY-TOUCH-Stroller-Playing-Rattles%EF%BC%8CMobile-Activity/dp/B0BX4349YB/ref=zg_bs_g_toys_d_sccl_14/259-0867102-6637049?psc=1","B0BX4349YB","https://images-eu.ssl-images-amazon.com/images/I/51u8YaleJmL._AC_UL600_SR600,400_.jpg"
"#65","EYSOO Magnetic Jigsaw Puzzles 3 Pack Jigsaw Puzzle Books Fruit Magnetic Puzzles for Kids 9+12+16 PCS Jigsaw Puzzles for Toddler Portable Travel Magnetic Puzzle Toy for 3+ Kids Boys Girls (Level 1-B)","SAR 29.98","4.5","https://www.amazon.sa//-/en/EYSOO-Magnetic-Puzzles-Toddler-Portable/dp/B0C7ZDJRJZ/ref=zg_bs_g_toys_d_sccl_15/259-0867102-6637049?psc=1","B0C7ZDJRJZ","https://images-eu.ssl-images-amazon.com/images/I/71Wnt5tvAYL._AC_UL600_SR600,400_.jpg"
"#66","Crayola MyFirst Washable Markers - Assorted Colours (Pack of 8) | Easy-Grip Markers Perfect for Toddlers Hands | Ideal for Kids Aged 12+ Months","SAR 32.99","4.6","https://www.amazon.sa//-/en/Crayola-MyFirst-Washable-Markers-Easy-Grip/dp/B00BG417HO/ref=zg_bs_g_toys_d_sccl_16/259-0867102-6637049?psc=1","B00BG417HO","https://images-eu.ssl-images-amazon.com/images/I/61Tq-OW7AjL._AC_UL600_SR600,400_.jpg"
"#67","Jackaro Strategic Planning Board Game Thin and Lightweight 40x40cm","SAR 49.26","3.3","https://www.amazon.sa//Jackaro-Strategic-Planning-Lightweight-40x40cm/dp/B0CJFV97V2/ref=zg_bs_g_toys_d_sccl_17/259-0867102-6637049?psc=1","B0CJFV97V2","https://images-eu.ssl-images-amazon.com/images/I/71TA8di4T7L._AC_UL600_SR600,400_.jpg"
"#68","LEGO® Minecraft® The Mushroom House 21179 Building Kit (272 Pieces)","SAR 97.46","4.8","https://www.amazon.sa//-/en/Minecraft%C2%AE-Mushroom-21179-Building-Pieces/dp/B09BNVFBPW/ref=zg_bs_g_toys_d_sccl_18/259-0867102-6637049?psc=1","B09BNVFBPW","https://images-eu.ssl-images-amazon.com/images/I/612nrUcBtTL._AC_UL600_SR600,400_.jpg"
"#69","RuleaxAsi Baby's First Non-Toxic Fabric Book 6Pcs Washable Soft Cloth Book Early Education Intelligent Toy for Infant Toddler Kids Learning","SAR 41.00","4.3","https://www.amazon.sa//-/en/RuleaxAsi-Non-Toxic-Washable-Education-Intelligent/dp/B08B82ZTTG/ref=zg_bs_g_toys_d_sccl_19/259-0867102-6637049?psc=1","B08B82ZTTG","https://images-eu.ssl-images-amazon.com/images/I/71awml-UBcL._AC_UL600_SR600,400_.jpg"
"#70","BEILAEEA Talking Flash Cards Learning Educational Toys for Speech Therapy Autism Sensory Toys, 2 Year (Pink)","SAR 21.10","4.2","https://www.amazon.sa//-/en/BEILAEEA-Talking-Learning-Educational-Therapy/dp/B09Y49DJYZ/ref=zg_bs_g_toys_d_sccl_20/259-0867102-6637049?psc=1","B09Y49DJYZ","https://images-eu.ssl-images-amazon.com/images/I/71S-Vk4T52L._AC_UL600_SR600,400_.jpg"
"#71","DMG Police Costume for Kids, 9 Piece Policeman Pretend Play Set Includes Shirt, Hat, Whistle, Walkie Talkie and other Cop Set made of plastic for Dress Up Party, Police Officer Costume, Role-Playing","SAR 71.10","4.1","https://www.amazon.sa//-/en/DMG-Costume-Policeman-Pretend-Role-Playing/dp/B0B2P98MVD/ref=zg_bs_g_toys_d_sccl_21/259-0867102-6637049?psc=1","B0B2P98MVD","https://images-eu.ssl-images-amazon.com/images/I/71IR2HHSI1L._AC_UL600_SR600,400_.jpg"
"#72","Gan 356 M Lite 3 x 3 Stickerless Magic Cube","SAR 69.99","4.8","https://www.amazon.sa//-/en/Gan-Lite-Stickerless-Magic-Cube/dp/B086PNKX2P/ref=zg_bs_g_toys_d_sccl_22/259-0867102-6637049?psc=1","B086PNKX2P","https://images-eu.ssl-images-amazon.com/images/I/61GCAwyNQML._AC_UL600_SR600,400_.jpg"
"#73","Denzoz Demon Slayer Sword 41inch, Anime Sword Original Texture, Katana Replica Sword for Cosplay and Collection Purpose (5)","SAR 79.80","3.9","https://www.amazon.sa//-/en/Denzoz-Original-Texture-Replica-Collection/dp/B0CFV6V2SK/ref=zg_bs_g_toys_d_sccl_23/259-0867102-6637049?psc=1","B0CFV6V2SK","https://images-eu.ssl-images-amazon.com/images/I/51GcahcD4FL._AC_UL600_SR600,400_.jpg"
"#74","Wemart 3-in-1 Kick Scooter, Adjustable Height Foldable Scooter Removable Seat, 3 LED Light Wheels and Anti-Slip Deck, Outdoor Activities for Boys Girls Ages 3-8","Price N/A","5.0","https://www.amazon.sa//-/en/Wemart-Adjustable-Removable-Anti-Slip-Activities/dp/B0CP3G2V4J/ref=zg_bs_g_toys_d_sccl_24/259-0867102-6637049?psc=1","B0CP3G2V4J","https://images-eu.ssl-images-amazon.com/images/I/61rqZcznjtL._AC_UL600_SR600,400_.jpg"
"#75","Hasbro The Classic Game of Connect 4; Strategy Game for 2 Players; Connect 4 Grid; Get 4 in a Row; Game for Kids Ages 6 and Up, Multicolor, A5640EF3","SAR 36.72","4.5","https://www.amazon.sa//-/en/Hasbro-Classic-Strategy-Multicolor-A5640EF3/dp/B085V5XG7S/ref=zg_bs_g_toys_d_sccl_25/259-0867102-6637049?psc=1","B085V5XG7S","https://images-eu.ssl-images-amazon.com/images/I/81QIrcCeh1L._AC_UL600_SR600,400_.jpg"
"#76","Baby Balance Bike 1 2 3 Years Old Boys Girls Toddler Ride on Toys for 1 Year Old Baby Trike Garden toys 1 st Birthday Gift for Girls Boys Baby Bike Walker No Pedals","SAR 73.00","3.6","https://www.amazon.sa//-/en/Balance-Toddler-Garden-Birthday-Walker/dp/B0C4KTTC6N/ref=zg_bs_g_toys_d_sccl_26/259-0867102-6637049?psc=1","B0C4KTTC6N","https://images-eu.ssl-images-amazon.com/images/I/51yFV1I-EVL._AC_UL600_SR600,400_.jpg"
"#77","Pepisky Y3 Lite Game Stick Console with Dual 2.4G Wireless Controllers Connnect TV High-definition Output with 64GB Card 10000 Games","SAR 65.99","3.2","https://www.amazon.sa//-/en/Pepisky-Wireless-Controllers-Connnect-High-definition/dp/B09NRBW3NM/ref=zg_bs_g_toys_d_sccl_27/259-0867102-6637049?psc=1","B09NRBW3NM","https://images-eu.ssl-images-amazon.com/images/I/61noGJxJT4L._AC_UL600_SR600,400_.jpg"
"#78","hand2mind MathLink Cubes Numberblocks 1-10 Activity Set, 30 Activities Linked to TV Episodes, Math Cubes, Counting Toys, Base Ten Blocks, Montessori Math, Counters for Kids Math, Kindergarten Toys","SAR 102.18","4.8","https://www.amazon.sa//-/en/hand2mind-Numberblocks-Activities-Montessori-Kindergarten/dp/B08ZR65PLQ/ref=zg_bs_g_toys_d_sccl_28/259-0867102-6637049?psc=1","B08ZR65PLQ","https://images-eu.ssl-images-amazon.com/images/I/810XMjioIbL._AC_UL600_SR600,400_.jpg"
"#79","Kick Scooters for Kids, DMG Scooter for Child Toddler Kick Scooter with Foldable, 4 Adjustable Height, سكوتر, Light Up Wheels for Ages 2-12Kids Balance Exercise(Pink)","SAR 98.00","3.0","https://www.amazon.sa//-/en/Scooters-DMG-Foldable-Adjustable-2-12Kids/dp/B0BDC7BFSB/ref=zg_bs_g_toys_d_sccl_29/259-0867102-6637049?psc=1","B0BDC7BFSB","https://images-eu.ssl-images-amazon.com/images/I/61plhETV+nL._AC_UL600_SR600,400_.jpg"
"#80","DMG Magnetic Tiles Building Blocks,Clear Magnetic 3D Building Blocks Construction Playboards,120PCS Educational Magnet Toys Recreational, Educational for Children Ages 3 Years + (120PCS)","SAR 127.80","4.4","https://www.amazon.sa//-/en/DMG-Construction-Playboards-Educational-Recreational/dp/B0B6HZG7LH/ref=zg_bs_g_toys_d_sccl_30/259-0867102-6637049?psc=1","B0B6HZG7LH","https://images-eu.ssl-images-amazon.com/images/I/61zZfdCnQSL._AC_UL600_SR600,400_.jpg"
"#81","Suitable for children's colored crayons, children's non-toxic washable water drop crayons, and school art supplies. A crayon that is easy to grip, sturdy, and not fragile (Waterdrop style, 12 colors)","SAR 31.00","5.0","https://www.amazon.sa//-/en/Suitable-childrens-non-toxic-supplies-Waterdrop/dp/B0CLDFH96Z/ref=zg_bs_g_toys_d_sccl_81/259-0867102-6637049?psc=1","B0CLDFH96Z","https://images-eu.ssl-images-amazon.com/images/I/71D95Uua-4L._AC_UL300_SR300,200_.jpg"
"#82","Cookeez Makery Oven Playset Cinnamon","SAR 206.60","4.4","https://www.amazon.sa//-/en/Cookeez-Makery-Oven-Playset-Cinnamon/dp/B0BQNFZXTQ/ref=zg_bs_g_toys_d_sccl_82/259-0867102-6637049?psc=1","B0BQNFZXTQ","https://images-eu.ssl-images-amazon.com/images/I/81+6Z1+SGoL._AC_UL300_SR300,200_.jpg"
"#83","Zerifam Magnetic Building Blocks - 120 Piece Set Magnetic Tiles, 3d Toddler Building Blocks, Develop Children's Creativity, Inspiration and Entertainment Beyond Imagination (120 pcs)","SAR 143.99","4.4","https://www.amazon.sa//-/en/Zerifam-Magnetic-Building-Blocks-Entertainment/dp/B0B3QH949S/ref=zg_bs_g_toys_d_sccl_83/259-0867102-6637049?psc=1","B0B3QH949S","https://images-eu.ssl-images-amazon.com/images/I/71+ecAT1n6L._AC_UL300_SR300,200_.jpg"
"#84","LEGO Speed Champions 1970 Ferrari 512 M, Official Ferrari X LEGO, Car Building Blocks Kit, Age 8+, 76906 (291 Pieces)","SAR 76.30","4.8","https://www.amazon.sa//-/en/LEGO-Champions-Official-Building-76906/dp/B09BNWR3VR/ref=zg_bs_g_toys_d_sccl_84/259-0867102-6637049?psc=1","B09BNWR3VR","https://images-eu.ssl-images-amazon.com/images/I/61zM6kbnUeL._AC_UL300_SR300,200_.jpg"
"#85","Wemart Makeup Set, Non-toxic Kids Makeup Set for Girls, Washable Kids Makeup Set with Mirror, Laptop Design, Little Girls Play Makeup, Toddler Makeup Set, Kids Makeup Set","SAR 55.19","4.0","https://www.amazon.sa//-/en/Wemart-Makeup-Non-toxic-Washable-Toddler/dp/B0BP6DR94Z/ref=zg_bs_g_toys_d_sccl_85/259-0867102-6637049?psc=1","B0BP6DR94Z","https://images-eu.ssl-images-amazon.com/images/I/718m0hpic-L._AC_UL300_SR300,200_.jpg"
"#86","Mochi Squishy Toys, 28PCS Animal Mini Squishies Kawaii Party Favors for Kids Cat Unicorn Squishy Squeeze Stress Relief Toys Goodie Bags Novelty Toy Gifts for Boys Girls Adults, Random","SAR 31.99","4.3","https://www.amazon.sa//-/en/Squishy-Squishies-Unicorn-Squeeze-Novelty/dp/B0BMV14VZQ/ref=zg_bs_g_toys_d_sccl_86/259-0867102-6637049?psc=1","B0BMV14VZQ","https://images-eu.ssl-images-amazon.com/images/I/61vzmF76rSL._AC_UL300_SR300,200_.jpg"
"#87","Snow Queen Costumes,Dress Girls Party Cosplay Girl Clothing Snow Queen Birthday Princess Dress Kids Costume Blue Costume With Accessory Set (150/7-8T)","SAR 99.99","4.7","https://www.amazon.sa//-/en/Costumes-Clothing-Birthday-Princess-Accessory/dp/B0BZCVVDY9/ref=zg_bs_g_toys_d_sccl_87/259-0867102-6637049?psc=1","B0BZCVVDY9","https://images-eu.ssl-images-amazon.com/images/I/51mRn1Zr1xL._AC_UL300_SR300,200_.jpg"
"#88","Ohuhu Mix Media Pad, 10""7.6"" Mixed Media Art Sketchbook, 120 Lb/200 Gsm Heavyweight Papers 62 Sheets/124 Pages, Spiral Bound Mixed Media Paper Pad For Acrylic, Watercolor, Painting","SAR 55.98","4.7","https://www.amazon.sa//-/en/Ohuhu-Sketchbook-Heavyweight-Watercolor-Painting/dp/B08HQKXT5R/ref=zg_bs_g_toys_d_sccl_88/259-0867102-6637049?psc=1","B08HQKXT5R","https://images-eu.ssl-images-amazon.com/images/I/81BTdiI8SZL._AC_UL300_SR300,200_.jpg"
"#89","Neelabil Target Shooting Games Toy Guns for Kids，Duck Toys for Kids， 2 Packs of Toy Foam Blasters with Movable Target, Interactive Competition Game Gift for Boys and Gls Ages 6 7 8 9 Years Old","SAR 58.00","4.0","https://www.amazon.sa//-/en/Neelabil-Shooting-Kids%EF%BC%8CDuck-Interactive-Competition/dp/B0CNLKSMQH/ref=zg_bs_g_toys_d_sccl_89/259-0867102-6637049?psc=1","B0CNLKSMQH","https://images-eu.ssl-images-amazon.com/images/I/71mxeltoypL._AC_UL300_SR300,200_.jpg"
"#90","Intex 44672 Action Figures Unisex 3 - 6 Years,Multi Color For Unisex","SAR 12.00","3.7","https://www.amazon.sa//-/en/Intex-44672-Action-Figures-Unisex/dp/B00DFUPKB6/ref=zg_bs_g_toys_d_sccl_90/259-0867102-6637049?psc=1","B00DFUPKB6","https://images-eu.ssl-images-amazon.com/images/I/71xeM1RrHpL._AC_UL300_SR300,200_.jpg"
"#91","WAMBORY Kids Makeup Kit for Girl - 20 Pcs Real Washable Non-Toxic Girls Makeup Kit for Kids with Cute Princess Cosmetic Purse, Play Makeup Toys for 4-10 Years Old Girls Gifts","SAR 43.88","4.8","https://www.amazon.sa//-/en/WAMBORY-Kids-Makeup-Kit-Girl/dp/B0B7JJ6KY5/ref=zg_bs_g_toys_d_sccl_91/259-0867102-6637049?psc=1","B0B7JJ6KY5","https://images-eu.ssl-images-amazon.com/images/I/71XOcpay+SL._AC_UL300_SR300,200_.jpg"
"#92","Intex 59040 Lively Print Balls, Assorted Color","SAR 7.00","4.2","https://www.amazon.sa//-/en/Intex-59040-Lively-Print-Assorted/dp/B000BCEJYA/ref=zg_bs_g_toys_d_sccl_92/259-0867102-6637049?psc=1","B000BCEJYA","https://images-eu.ssl-images-amazon.com/images/I/51qow1esllL._AC_UL300_SR300,200_.jpg"
"#93","Board GAME Multi Color Board Game for Family.8021","SAR 29.42","4.5","https://www.amazon.sa//-/en/Board-GAME-Multi-Color-Family-8021/dp/B08D7P32CR/ref=zg_bs_g_toys_d_sccl_93/259-0867102-6637049?psc=1","B08D7P32CR","https://images-eu.ssl-images-amazon.com/images/I/7107a2UKonL._AC_UL300_SR300,200_.jpg"
"#94","Taimi Princess Party Dressing Box Set Simulation Dressing Table Makeup Toy Cosmetics Pretend Play Kit","SAR 19.99","4.2","https://www.amazon.sa//-/en/Taimi-Princess-Dressing-Simulation-Cosmetics/dp/B0CS3N9KWB/ref=zg_bs_g_toys_d_sccl_94/259-0867102-6637049?psc=1","B0CS3N9KWB","https://images-eu.ssl-images-amazon.com/images/I/61Pos50zP3L._AC_UL300_SR300,200_.jpg"
"#95","Paint Your Own Cat Lamp Kit, Art Supplies Arts & Crafts Kit, Painting kit for Kids 6-12, Arts and Crafts for Kids Ages 8-12, Toys Girls Boy Birthday Gift Ages 3 4 5 6 7 8 9 10 11 12+","SAR 46.90","Rating N/A","https://www.amazon.sa//-/en/Paint-Supplies-Crafts-Painting-Birthday/dp/B0CP24VV2V/ref=zg_bs_g_toys_d_sccl_95/259-0867102-6637049?psc=1","B0CP24VV2V","https://images-eu.ssl-images-amazon.com/images/I/819RLSh1A+L._AC_UL300_SR300,200_.jpg"
"#96","SQK - Little Plush (5"" Squishmallows) (SP23 Scented Mystery Bags) (Brunch Squad - Orange Juice, Pancakes, Latte, Toaster Pastry, Smoothie, Breakfast Burrito) (No PDQ)","SAR 39.20","4.7","https://www.amazon.sa//-/en/SQK-Squishmallows-Pancakes-Smoothie-Breakfast/dp/B0BQ4VWGC4/ref=zg_bs_g_toys_d_sccl_96/259-0867102-6637049?psc=1","B0BQ4VWGC4","https://images-eu.ssl-images-amazon.com/images/I/51esLpUwpNL._AC_UL300_SR300,200_.jpg"
"#97","Baby Gender Reveal Board, Party Supplies Kit with Decorations Games Gender Reveal Voting Poster Board with Stickers, Chalkboard Design Party Games Kit (Cute)","SAR 39.84","3.9","https://www.amazon.sa//-/en/Gender-Supplies-Decorations-Stickers-Chalkboard/dp/B09YH4R5S9/ref=zg_bs_g_toys_d_sccl_97/259-0867102-6637049?psc=1","B09YH4R5S9","https://images-eu.ssl-images-amazon.com/images/I/71NVzMdlwgL._AC_UL300_SR300,200_.jpg"
"#98","CoComelon Melon Car Mini Vehicle Toy, Multicolor","SAR 40.60","4.6","https://www.amazon.sa//-/en/CoComelon-Melon-Mini-Vehicle-Multicolor/dp/B0B65862GZ/ref=zg_bs_g_toys_d_sccl_98/259-0867102-6637049?psc=1","B0B65862GZ","https://images-eu.ssl-images-amazon.com/images/I/61hFblbZJoL._AC_UL300_SR300,200_.jpg"
"#99","WAMBORY Jumping Toys, Foam Pogo Jumper for Kids, Fun and Safe Childs Pogo Stick for Toddlers, Indoor Outdoor Bungee Jump toys for Childs Over 3 Years Old (Red)","SAR 53.88","4.3","https://www.amazon.sa//-/en/WAMBORY-Jumping-Jumper-Toddlers-Outdoor/dp/B09V4TS738/ref=zg_bs_g_toys_d_sccl_99/259-0867102-6637049?psc=1","B09V4TS738","https://images-eu.ssl-images-amazon.com/images/I/51TE7JHSXsL._AC_UL300_SR300,200_.jpg"
"#100","MSZ – Lamborghini SVJ – Yellow | Die-Cast Replica, Ultimate Collector's Item, Super Cars | Toy Vehicles, Metal Toy Car Model - Pull Back Collection | Size - 1:64, For Kids 3+","SAR 12.27","5.0","https://www.amazon.sa//-/en/MSZ-Lamborghini-Die-Cast-Collectors-Collection/dp/B0CLS55Q8W/ref=zg_bs_g_toys_d_sccl_100/259-0867102-6637049?psc=1","B0CLS55Q8W","https://images-eu.ssl-images-amazon.com/images/I/51HL6GaPFCL._AC_UL300_SR300,200_.jpg"